aptos_por_local,bairro,endereco,lat,local_de_votacao,long,secoes_eleitorais,zona_eleitoral_nome,zona_eleitoral_nro
4173,VILA ZILDA,"RUA SOUSA BREVES, 80, São Paulo",-23.555805,EE. PROF. JOÃO DIAS DA SILVEIRA,-46.546326,416ª; 418ª; 443ª; 452ª; 461ª; 463ª; 471ª; 486ª; 491ª; 501ª; 511ª; 524ª;,TATUAPÉ,253
5184,SAUDE,"AV. INHAIBA, 92, São Paulo",-23.612812,EE. RAUL FONSECA,-46.608742,Da 161ª à 176ª.,CURSINO,413
3064,PARQUE DAS FLORES,"RUA DOS LÍRIOS, 02, São Paulo",-23.603003,EMEF. PROFA. MARIA APARECIDA VILASBOAS,-46.468735,566ª; 581ª; 590ª; 598ª; 605ª; 612ª; 617ª; 630ª; 658ª; 685ª; 717ª;,SÃO MATEUS,375
4860,JARDIM SANTO ANDRÉ,"RUA GODOY BUENO, 19, São Paulo",-23.604262,EE. PROF. MARCOS ANTONIO COSTA,-46.463928,353ª; 362ª; 388ª; 401ª; 413ª; 426ª; 442ª; 461ª; 473ª; 488ª; 502ª; 513ª; 532ª; 655ª; 684ª; 712ª; 732ª;,SÃO MATEUS,375
3387,RESIDENCIAL SOL NASCENTE,"RUA SÃO MARCOS, 79, São Paulo",-23.450648,EE. PARQUE ANHANGUERA,-46.71936,Da 214ª à 221ª; 273ª; 341ª; 477ª;,PERUS,389
6796,JARDIM CARUMBÉ,"RUA FLORIANO DA COSTA BARROSO, 10, São Paulo",-23.466396,EE. PROFESSOR RENATO DE ARRUDA PENTEADO,-46.684341,337ª; 344ª; 348ª; 364ª; 377ª; 391ª; 407ª; Da 428ª à 429ª; 442ª; 451ª; 465ª; 477ª; 485ª; 498ª; 515ª; 568ª; 587ª;,BRASILÂNDIA,376
1364,JARDIM GUARANI,"RUA SANTANA DO ARACUARI, 185, São Paulo",-23.465136,EMEI VEREADOR ALEX FREUA NETTO,-46.695328,417ª; 443ª; 464ª; 483ª;,BRASILÂNDIA,376
3495,VILA ARICANDUVA,"RUA DR. LUIS CARLOS, 740, São Paulo",-23.531255,EE DONA ZALINA ROLIM,-46.498947,Da 1ª à 7ª; 293ª; 354ª; 417ª; 429ª;,VILA MATILDE,347
2760,VILA ROMANA,"PRAÇA ALFREDO WEISZFLOG, S/N, São Paulo",-23.52307,EMEI. NOEMIA IPPÓLITO,-46.714554,Da 283ª à 287ª; 341ª; 369ª;,LAPA,250
4575,JARDIM SHANGRILA(ZONA NORTE),"RUA PRÍNCIPE, 38, São Paulo",-23.440569,EMEF. PROF. ANTONIO RODRIGUES DE CAMPOS,-46.720734,Da 120ª à 122ª; 258ª; 265ª; 286ª; 301ª; 323ª; 356ª; 365ª; 377ª; 398ª;,PERUS,389
3209,SITIO VALE VERDE,"RUA PROJETADA,64, São Paulo",-23.696092,EE. JARDIM CAPELA II,-46.766739,247ª; 251ª; 253ª; 256ª; 260ª; Da 266ª à 267ª; 271ª; 344ª; 354ª;,PIRAPORINHA,372
3687,JARDIM SANTA FÉ (ZONA SUL),"RUA JULIA MAMÉIA, 200, São Paulo",-23.758953,EMEF. PROF. AYRTON OLIVEIRA SAMPAIO,-46.706314,Da 179ª à 183ª; Da 265ª à 266ª; 280ª; 300ª; 307ª; 556ª;,PARELHEIROS,381
1789,JARDIM SANTA FÉ (PARELHEIROS),"RUA CONDE DE LACASTRE, 209, São Paulo",-23.759581,EMEF. ULYSSES DA SILVEIRA GUIMARÃES,-46.705627,376ª; 393ª; 408ª; 433ª; 481ª; 527ª; 566ª;,PARELHEIROS,381
2328,JARDIM ELZA,"RUA FERNANDO DE GODOI, 21, São Paulo",-23.521811,EE. PROF. JOÃO BATISTA VILANOVA ARTIGAS,-46.389084,Da 117ª à 122ª; 550ª; 570ª; 583ª;,ITAIM PAULISTA,352
3863,AGUA BRANCA,"RUA SABAÚNA, S/N, São Paulo",-23.528107,EE. RAUL CORTEZ,-46.698074,Da 288ª à 289ª; 305ª; 324ª; 344ª; 373ª; 392ª; 400ª; 418ª; 427ª; 448ª;,LAPA,250
49,VILA LEOPOLDINA,"AV. NAÇÕES UNIDAS, 1230, São Paulo",-23.511737,CDP III  CENTRO DE DETENÇÃO PROVISÓRIA DE PINHEIROS III,-46.704254,442ª.,LAPA,250
5917,JARDIM CAMARGO NOVO,"RUA DA CONQUISTA , 50, São Paulo",-23.487179,EE. DEPUTADO JOÃO DÓRIA,-46.399384,300ª; 310ª; 323ª; 326ª; 333ª; 342ª; 349ª; 355ª; 374ª; 382ª; 389ª; 396ª; 406ª; 411ª; 423ª; 432ª; 442ª; 451ª;,ITAIM PAULISTA,352
4493,CIDADE PATRIARCA,"RUA PEDRO MORCILLA FILHO, 578, São Paulo",-23.555175,EMEF. FIRMINO TIBÚRCIO DA COSTA,-46.491394,Da 196ª à 206ª; 419ª;,VILA MATILDE,347
6772,JARDIM MARIA FERNANDES,"RUA ARCELINA TEIXEIRA DA SILVA, S/N, São Paulo",-23.75581,EE. JORGE SARAIVA,-46.703568,113ª; Da 208ª à 222ª; 506ª; 518ª; 557ª;,PARELHEIROS,381
3475,JARDIM IVA,"RUA PROFA. ALZIRA DE OLIVEIRA GILIOLI, 32, São Paulo",-23.552658,EMEF ROQUETE PINTO,-46.534653,479ª; 489ª; 498ª; 508ª; 523ª; 533ª; 540ª; 574ª; 587ª; 611ª; 629ª; 637ª; 648ª;,TATUAPÉ,253
4270,JARDIM MANGALOT,"RUA GENERAL LAURO CAVALCANTI DE FARIAS, 438, São Paulo",-23.538337,EMEF. JAIRO RAMOS,-46.719532,308ª; 333ª; 361ª; 366ª; 375ª; 388ª; 394ª; 401ª; 410ª; 416ª; 433ª; 449ª;,LAPA,250
4257,VILA DALVA,"RUA PADRE PAULO CANELLES, 611, São Paulo",-23.570281,EMEF. GENERAL  ÁLVARO SILVA BRAGA,-46.761246,Da 279ª à 283ª; 306ª; 316ª; 331ª; 357ª; 385ª; 415ª; Da 583ª à 584ª;,RIO PEQUENO,374
5336,JARDIM JOAO XXIII,"AV. DO VATICANO, 245, São Paulo",-23.583497,EE. JOÃO XXIII,-46.772919,329ª; 333ª; 338ª; 340ª; 363ª; 372ª; 382ª; 396ª; 410ª; 416ª; 434ª; 442ª; 455ª; 464ª; 475ª; 547ª;,RIO PEQUENO,374
3885,JARDIM GUARUJA,"RUA ARTUR JOSE IGNACIO,30, São Paulo",-23.679429,EMEF MAURO FACCIO GONCALVES ZACARIA,-46.748543,203ª; 214ª; 233ª; 242ª; 250ª; 263ª; 274ª; 284ª; 294ª; 304ª;,PIRAPORINHA,372
852,JARDIM NELIA,"RUA MANFREDO FESTI 160, São Paulo",-23.50733,EE. REPÚBLICA DA GUATEMALA,-46.387711,416ª; 461ª; 478ª; 558ª;,ITAIM PAULISTA,352
8358,JARDIM CAMBARA,"RUA DOM FRANCISCO CARDOSO AYRES, 285, São Paulo",-23.584755,EE. PROFA. GUIOMAR DA ROCHA RINALDI,-46.773605,Da 68ª à 84ª; 297ª; 303ª; 310ª; 313ª; 317ª; 320ª; Da 563ª à 564ª;,RIO PEQUENO,374
6828,ITAIM PAULISTA,"RUA PADRE VIRGÍLIO CAMPELLO, 130, São Paulo",-23.497098,EE. MADRE PAULINA,-46.391315,309ª; 314ª; 318ª; 329ª; 337ª; 343ª; 348ª; 354ª; 357ª; 373ª; 380ª; 386ª; 391ª; 397ª; 404ª; 409ª; 419ª; 426ª; 434ª; 441ª; 453ª;,ITAIM PAULISTA,352
6342,JARDIM CAMARGO NOVO,"AVENIDA JOSÉ BORGES DO CANTO, 18, São Paulo",-23.508589,EMEF. EZEQUIEL RAMOS JUNIOR,-46.378098,211ª; 218ª; 221ª; 226ª; 230ª; 232ª; 235ª; 238ª; 242ª; 247ª; 252ª; 258ª; Da 262ª à 263ª; 268ª; 274ª; 277ª; 472ª;,ITAIM PAULISTA,352
7170,MORRO DO INDIO,"RUA CIPOTUBA, 37, São Paulo",-23.688211,EE. PASTOR CÍCERO CANUTO DE LIMA,-46.778996,Da 103ª à 123ª.,VALO VELHO,20
5407,PARQUE SAO JORGE,"RUA JOSÉ TAVARES DE SIQUEIRA, 198, São Paulo",-23.57091,EE. PROFª BENEDITA RIBAS FURTADO DA SILVEIRA,-46.524353,Da 38ª à 51ª; 595ª;,TATUAPÉ,253
1638,COHAB TAIPAS,"AVENIDA ELISIO TEIXEIRA LEITE, S/N., São Paulo",-23.454428,EMEF. PROFª  ALICE MEIRELLES REIS,-46.724854,384ª; 399ª; 416ª; 419ª; 431ª; 444ª; 454ª; 474ª;,PERUS,389
6255,VILA CATUPIA,"RUA URUTINGA, 144, São Paulo",-23.468285,EMEF. MÁRIO KOSEL FILHO,-46.741333,Da 81ª à 93ª; 324ª; 336ª; 345ª;,PIRITUBA,325
7547,JARDIM SÃO PEDRO,"RUA PROFA. LUCILA CERQUEIRA, 100, São Paulo",-23.56147,EE. PROFA. SUMIÊ IWATA,-46.427536,Da 157ª à 171ª; 196ª; 201ª; 207ª; 218ª; 232ª;,CONJUNTO JOSÉ BONIFÁCIO,405
2358,JARDIM AUREA,"RUA HENRIQUE ADAMUS, 15, São Paulo",-23.564617,EMEF. PROF. LUIZ ROBERTO MEGA,-46.436462,205ª; 214ª; 220ª; 224ª; 245ª; 251ª; 256ª; 264ª;,CONJUNTO JOSÉ BONIFÁCIO,405
3207,BRAS,"RUA MONSENHOR DE ANDRADE, 798, São Paulo",-23.540383,ETE. CARLOS DE CAMPOS,-46.624603,Da 152ª à 157ª; Da 195ª à 197ª;,SANTA IFIGÊNIA,3
5311,CENTRO,"LARGO DE SÃO BENTO, S/N, São Paulo",-23.53755,COLÉGIO DE SÃO BENTO,-46.636276,Da 1ª à 13ª; 215ª;,SANTA IFIGÊNIA,3
5878,VILA NOVA MAZZEI,"RUA DOS IMBIRAS, 49, São Paulo",-23.476473,EE. PEDRO ALEXANDRINO,-46.625977,Da 200ª à 213ª; 341ª;,TUCURUVI,256
4814,JARDIM SAO MANOEL,"RUA PROF.  ANTÔNIO CASTELAR DE FRANCESCHI, 200, São Paulo",-23.470805,EE. CONSELHEIRO RUY BARBOSA,-46.60881,Da 185ª à 190ª; 239ª; 257ª; 306ª; 339ª; 420ª; 432ª;,TUCURUVI,256
4850,PENHA DE FRANÇA,"PRAÇA OITO DE SETEMBRO, 73, São Paulo",-23.525274,EE. SANTOS DUMONT,-46.534653,Da 11ª à 21ª; 224ª; 242ª; 304ª;,PENHA DE FRANÇA,252
6956,JARDIM AURORA (ZONA LESTE),"RUA ANIBAL THOMAZ GOMES,  87, São Paulo",-23.529996,EE. MAJOR COSME DE FARIA,-46.411743,458ª; 467ª; 488ª; 513ª; 539ª; 563ª; 594ª; 628ª; 658ª; 684ª; 716ª; 742ª; 778ª; 803ª; 817ª; 881ª; 898ª; 921ª; 948ª;,GUAIANASES,353
4757,PARQUE AMERICA,"RUA ESTELA NAVES JUNQUEIRA, 79, São Paulo",-23.749211,EE. PRESIDENTE RENE MUAWAD,-46.679878,263ª; 271ª; 278ª; 295ª; 301ª; 313ª; 324ª; 331ª; 391ª; 417ª; 420ª; 437ª;,GRAJAÚ,371
7329,CASA VERDE ALTA,"RUA JOAQUIM AFONSO DE SOUZA, 355, São Paulo",-23.502765,EE. JOAQUIM NABUCO,-46.667175,Da 185ª à 202ª; 496ª;,CASA VERDE,255
6817,PARQUE DOS BANCARIOS,"RUA GUARANTÃ, S/N, São Paulo",-23.606936,EMEF. ARQUITETO VILANOVA ARTIGAS,-46.493969,Da 125ª à 142ª; 288ª;,TEOTÔNIO VILELA,421
3711,JARDIM DA SAUDE,"PRAÇA JOÃO RODRIGUES, 575, São Paulo",-23.621878,EMEF. JOSÉ MARIA LISBOA,-46.610012,Da 213ª à 215ª; 272ª; 288ª; 295ª; 311ª; 320ª; 332ª; 353ª; 361ª; 370ª;,CURSINO,413
803,SANTA CECILIA,"RUA SÃO VICENTE DE PAULA, 374, São Paulo",-23.535662,COLÉGIO EQUIPE,-46.676788,491ª; 501ª; 506ª; 509ª; 519ª;,PERDIZES,2
3393,VILA SANTANA,"RUA N. SRA. DE MONTE VERGINE, 63, São Paulo",-23.529996,COLÉGIO MONTE VIRGEM,-46.51474,247ª; 254ª; 259ª; 268ª; 273ª; 278ª; 280ª; 289ª; 320ª;,PENHA DE FRANÇA,252
4582,CHACARA INGLESA,"RUA CARLOS ALBERTO DA CUNHA MATTOS, 134, São Paulo",-23.490958,EMEF. PROF. GABRIEL PRESTES,-46.722794,Da 125ª à 136ª; 649ª;,PIRITUBA,325
5114,VILA AFONSO CELSO,"RUA DR. THIRSO MARTINS, 211, São Paulo",-23.605835,EE. LASAR SEGALL,-46.642456,Da 76ª à 87ª; 454ª; 592ª; 639ª; 673ª;,SAÚDE,259
6766,VILA NANCY,"RUA PORTO DO BEZERRA,  25, São Paulo",-23.538809,EMEF. ALEXANDRE DE GUSMAO,-46.41243,405ª; 412ª; Da 452ª à 453ª; 523ª; 554ª; 592ª; 633ª; 662ª; 691ª; 717ª; 744ª; 779ª; 808ª; 820ª; 879ª; 900ª; 946ª;,GUAIANASES,353
3700,GUAIANAZES,"RUA JOSÉ PINHEIRO BORGES,  60, São Paulo",-23.548881,CEU. JAMBEIRO,-46.39595,832ª; 834ª; 847ª; 852ª; 862ª; 869ª; 875ª; 891ª; 906ª; 917ª; 941ª; 962ª; 977ª;,GUAIANASES,353
2654,VILA BRASILANDIA,"RUA INTERATIVA, 100, São Paulo",-23.443246,EMEF. ERNANI SILVA BRUNO,-46.72039,Da 102ª à 104ª; 260ª; 283ª; 309ª; 329ª; 352ª;,PERUS,389
3317,CONJUNTO HABITACIONAL JOVA RURAL,"RUA JOSÉ MILTON BARBOSA, 138, São Paulo",-23.488439,EE. FELÍCIO TONETTI,-46.604862,449ª; 484ª; 505ª; 535ª; 559ª; 587ª; 592ª; 608ª; 616ª;,JAÇANÃ,349
4194,JORDANOPOLIS,"RUA LUIZ VIANA, 110, São Paulo",-23.697664,EE. PROF. JAYR DE ANDRADE,-46.701679,706ª; 728ª; 740ª; 757ª; 774ª; 784ª; 798ª; 814ª; 824ª; 840ª; 849ª;,CAPELA DO SOCORRO,280
4150,JARDIM GAIVOTAS,"AVENIDA SÃO PAULO, S/N, São Paulo",-23.76398,EE. LOTEAMENTO DAS GAIVOTAS 2,-46.685371,Da 741ª à 742ª; 750ª; 757ª; 765ª;,GRAJAÚ,371
5235,PARQUE DO CASTELO,"RUA ALCINDO FERREIRA, 2, São Paulo",-23.69955,EE. PADRE FRANCISCO JOÃO DE AZEVEDO,-46.704941,Da 56ª à 67ª; 615ª; 713ª; 746ª;,CAPELA DO SOCORRO,280
2115,JARDIM CENTENÁRIO,"AVENIDA FELIX ALVES PEREIRA, S/N, São Paulo",-23.500718,EMEBS. PROF. MÁRIO PEREIRA BICUDO,-46.66872,393ª; 397ª; 411ª; 418ª; 438ª; 440ª; 517ª;,CASA VERDE,255
2327,VILA DALVA,"RUA  BORIS ALEXANDRE, 189, São Paulo",-23.587902,EE. SAMUEL KLABIN,-46.784248,342ª; 368ª; 430ª; 448ª; 478ª; 498ª; 517ª; 567ª;,RIO PEQUENO,374
3043,VILA ISOLINA MAZZEI,"RUA NILO LUIS MAZZEI, 378, São Paulo",-23.510321,EE. DEPUTADO PEDRO COSTA,-46.588726,Da 192ª à 199ª; 329ª;,VILA MARIA,254
1180,VILA DA PAZ,"RUA JOÃO PAULO DA SILVA, 259, São Paulo",-23.701122,EMEI. DR. ALBERT SABIN,-46.686401,789ª; 815ª; 844ª; 871ª;,CAPELA DO SOCORRO,280
2268,JAÇANÃ,"RUA SÃO LUIZ GONZAGA, 62, São Paulo",-23.473009,EMEI. PROFA. OTTÍLIA DE JESUS PIRES,-46.583576,450ª; 462ª; 469ª; 482ª; 497ª; 521ª;,JAÇANÃ,349
7492,JAÇANÃ,"RUA ALCY BORGES DOS SANTOS, 242, São Paulo",-23.464506,EMEF. OCTÁVIO PEREIRA LOPES,-46.576881,15ª; Da 27ª à 38ª; 413ª; 421ª; 437ª; 464ª; 483ª; 501ª; 580ª;,JAÇANÃ,349
3329,JARDIM ROBRU,"RUA JOÃO MENDES DE CARVALHO, 40, São Paulo",-23.507015,EE. PROF. AMADOR DOS SANTOS FERNANDES,-46.410027,Da 87ª à 91ª; 274ª; 308ª; 324ª; 370ª;,JARDIM HELENA,397
1934,LIMOEIRO,"RUA DANIEL ARCIONI, 80, São Paulo",-23.50733,EE. REVERENDO JOSÉ BORGES DOS SANTOS JR.,-46.455688,Da 98ª à 100ª; 203ª; 224ª; 273ª; 292ª;,VILA JACUÍ,398
2925,VILA ARCADIA,"RUA ENÉIAS LUÍS CARLOS BARBANTI, 660, São Paulo",-23.491902,EMEF. PRESIDENTE NILO PEÇANHA,-46.701164,Da 198ª à 203ª; 494ª; 502ª;,NOSSA SENHORA DO Ó,327
47,ITAQUERA,"AV. MIGUEL IGNACIO CURI, 1311, São Paulo",-23.531097,UI-UNIDADE DE INTERNAÇÃO ITAQUERA - FUNDAÇÃO CASA,-46.439896,850ª.,ITAQUERA,248
1829,VILA VERDE,"RUA ORLANDO FRATUCCELLI, 150, São Paulo",-23.547937,EMEI VILA VERDE,-46.451569,815ª; 827ª; 842ª; 847ª; 854ª; 870ª;,ITAQUERA,248
6967,VILA PROGRESSO,"RUA INAJA GUAÇU, 13, São Paulo",-23.532986,EMEF. PADRE JOSÉ DE ANCHIETA,-46.445389,Da 435ª à 450ª; Da 516ª à 517ª;,ITAQUERA,248
4671,PARQUE BOTURUSSU,"AV. SÃO MIGUEL, 4.335, São Paulo",-23.50245,COLÉGIO CARLOS DRUMMOND DE ANDRADE,-46.489334,Da 306ª à 313ª; 536ª; 557ª; 559ª; 574ª; 618ª; 628ª;,ERMELINO MATARAZZO,326
5763,VILA RICA,"AV. DR. ASSIS RIBEIRO, 8.402, São Paulo",-23.490171,E.E. PROFª BENEDITA DE REZENDE,-46.493111,Da 1ª à 11ª; 580ª; 625ª; 645ª; 745ª;,ERMELINO MATARAZZO,326
4060,VILA SÃO FRANCISCO,"RUA ANTÔNIO DE TOLEDO LARA FILHO, 116, São Paulo",-23.526218,EE. PROFESSOR LUIZ GONZAGA DE CARVALHO MELO,-46.492081,Da 239ª à 248ª; 266ª; 340ª;,PONTE RASA,392
6758,VILA CURUÇÁ,"RUA JOÃO MAXIMIANO MAFRA, 6, São Paulo",-23.498357,EE. SHINQUICHI AGARI,-46.428566,388ª; 430ª; 437ª; 441ª; 457ª; 476ª; 492ª; 514ª; 534ª; 545ª; 571ª; 726ª; 737ª; 755ª; Da 759ª à 760ª; 762ª;,SÃO MIGUEL PAULISTA,247
7472,VILA MARIANA,"RUA COLÔNIA DA GLÓRIA, 536, São Paulo",-23.584441,EE. PROF. ROLDÃO LOPES DE BARROS,-46.62632,Da 273ª à 293ª.,VILA MARIANA,6
6304,PARQUE SAVOI CITY,"RUA VITALINO DOS SANTOS, 85, São Paulo",-23.561784,EE. DR. PAULO LAURO,-46.473885,Da 177ª à 191ª; 284ª;,PARQUE DO CARMO,417
4686,TERCEIRA DIVISÃO,"AV. SAPOPEMBA, 21964, São Paulo",-23.605363,EE. PROFA. RITA PINTO DE ARAÚJO,-46.416721,Da 38ª à 47ª; 296ª; 331ª;,CIDADE TIRADENTES,404
3251,COLONIA (ZONA LESTE),"ESTRADA DO PÊSSEGO, 1400, São Paulo",-23.56147,EE. PROFA. LINA DA COSTA COUTO,-46.479034,Da 162ª à 168ª; 243ª;,PARQUE DO CARMO,417
2760,VILA LIBANESA,"RUA PAULO DE LIMA CORREA, 65, São Paulo",-23.585699,EMEF. MAJOR SÍLVIO FLEMING,-46.563148,Da 330ª à 336ª; 356ª; 472ª;,VILA PRUDENTE,257
889,V DO ENCONTRO,"RUA EUDORA, 56, São Paulo",-23.65727,CEI. HELENA IRACY JUNQUEIRA,-46.637909,454ª; 470ª; 511ª;,JABAQUARA,320
2971,VILA SANTA CLARA,"RUA SÍLVIO DE SOUSA, 259, São Paulo",-23.584913,COLÉGIO PARQUE SEVILHA,-46.571217,361ª; 379ª; 389ª; 414ª; 424ª; 428ª; 438ª; 452ª;,VILA PRUDENTE,257
6921,JARDIM UMUARAMA,"AVENIDA INTERLAGOS, 1.329, São Paulo",-23.67377,UNIVERSIDADE IBIRAPUERA,-46.652756,Da 592ª à 593ª; Da 595ª à 596ª; 598ª; 601ª; 603ª; 606ª; 608ª; 610ª; 613ª; 615ª; 620ª; Da 640ª à 641ª; Da 644ª à 645ª; 647ª; 714ª;,CIDADE ADEMAR,351
1475,CIDADE JULIA,"AV. FRANCESCO MARIA MELANI, S/N, São Paulo",-23.665909,EMEF. PROF. LILIANE VERZINI SILVA,-46.673012,712ª; 718ª; 720ª; 722ª; 726ª; 730ª; 735ª;,CIDADE ADEMAR,351
3545,CHÁCARA COCAIA,"RUA TUPINAMBÁS, 71, São Paulo",-23.751411,EE. OTONIEL ASSIS DE HOLANDA,-46.711807,371ª; 375ª; 377ª; 385ª; 395ª; 400ª; 415ª; 423ª; 437ª; 446ª;,PARELHEIROS,381
6479,JARDIM UMARIZAL,"RUA JARACATIA, 488, São Paulo",-23.626911,EMEF. MINISTRO SYNÉSIO ROCHA,-46.761932,Da 81ª à 92ª; 522ª; 537ª; 553ª; 823ª; 847ª; 864ª;,CAMPO LIMPO,328
6431,PARQUE GRAJAU,"RUA MIRAFLORES, 95, São Paulo",-23.758324,EE. PROFA. MARIA JUVENAL HOMEM DE MELLO,-46.693954,259ª; Da 285ª à 286ª; 305ª; 321ª; 337ª; 354ª; 368ª; 387ª; 406ª; 434ª; 467ª; 496ª; 526ª; 543ª; 548ª;,GRAJAÚ,371
2379,CAXINGUI,"PRAÇA IMPRENSA PAULISTA, 30, São Paulo",-23.599228,EMEF. MAL. DEODORO DA FONSECA,-46.711807,Da 504ª à 505ª; Da 507ª à 508ª; 536ª; 574ª;,BUTANTÃ,346
37,PIRITUBA,"RUA STEFANO MAUSER, 651, São Paulo",-23.47335,INTERNATO PIRITUBA,-46.735939,662ª.,PIRITUBA,325
4271,FERREIRA,"RUA DR. ADOLPHO DE MELLO JÚNIOR, 156, São Paulo",-23.605992,EE. THOMAZIA MONTORO,-46.719189,Da 68ª à 78ª.,BUTANTÃ,346
5642,VILA ELZE,"RUA CORONEL AUGUSTO CELSO DE MOURA,78, São Paulo",-23.604262,EMEF. ALTINO ARANTES,-46.529846,Da 142ª à 154ª; 384ª; 616ª; 633ª;,SAPOPEMBA,350
6559,JARDIM IMBE,"RUA FRANCISCO DE ABREU,S/N, São Paulo",-23.674084,EE. PROFESSORA DAVINA AGUIAR DIAS,-46.780472,Da 153ª à 169ª; 608ª;,CAPÃO REDONDO,373
2602,VILA CAMPANELA,"RUA PIERRE JANSEN, 40, São Paulo",-23.521811,EMEI EVARISTO DA VEIGA,-46.496887,Da 187ª à 193ª; 312ª;,PONTE RASA,392
4870,JARDIM SANTA LUCRECIA,"RUA VALE DAS FLORES, 120, São Paulo",-23.455688,EMEF. ERNESTO MORAES LEME,-46.739273,Da 125ª à 129ª; 136ª; 140ª; 144ª; 147ª; 151ª; 196ª; 225ª; 238ª; 245ª; 251ª;,JARAGUÁ,403
9680,IPIRANGA,"RUA SILVA BUENO, 1412, São Paulo",-23.590839,EE. VISCONDE DE ITAÚNA,-46.601509,Da 1ª à 25ª.,IPIRANGA,260
2224,PARQUE GRAJAU,"RUA JOSÉ BEZERRA FILHO, 62, São Paulo",-23.74848,COLÉGIO SANTA RITA DE CÁSSIA,-46.686249,Da 47ª à 52ª.,GRAJAÚ,371
5401,VILA NOVA CURUÇÁ,"RUA ANANAÍ, 968, São Paulo",-23.522619,EMEF. JOÃO RIBEIRO DE BARROS,-46.418991,Da 692ª à 706ª; 750ª;,SÃO MIGUEL PAULISTA,247
3103,PARQUE SEVILHA,"RUA MADRID, 550, São Paulo",-23.575983,EMEF. BARÃO DE MAUÁ,-46.570511,Da 73ª à 80ª; 471ª;,VILA PRUDENTE,257
6075,GRAJAU,"RUA SÃO JOSÉ DO RIO PRETO, 71, São Paulo",-23.753302,EE. SAMUEL WAINER,-46.682762,Da 16ª à 32ª; 631ª;,GRAJAÚ,371
4465,VILA JACUÍ,"RUA JAIME BARCELOS, 535, São Paulo",-23.501255,EE. TIDE SETÚBAL,-46.448689,Da 101ª à 111ª; 230ª;,VILA JACUÍ,398
5251,JARDIM SAPOPEMBA,"AV. JOÃO RODRIGUES RUIZ, 248, São Paulo",-23.610556,EM. OLIVAL COSTA,-46.493862,Da 79ª à 93ª.,TEOTÔNIO VILELA,421
1020,VILA JAGUARA,"RUA PAÚVA, 677, São Paulo",-23.51362,EMEI PEDRO DE TOLEDO,-46.74675,353ª; 359ª; 397ª;,LAPA,250
376,PARQUE NOVO MUNDO,"RUA SARGENTO JETER AUGUSTO PEREIRA, 121, São Paulo",-23.51228,CEI MÁRIO DA COSTA BARBOSA,-46.566319,439ª; 470ª;,VILA MARIA,254
3872,IPIRANGA,"RUA GREENFELD, 130, São Paulo",-23.601452,EE. PROF. JOSÉ ESCOBAR,-46.60247,Da 137ª à 146ª.,IPIRANGA,260
1727,JARDIM VERÔNIA,"RUA JAN LAND, 14, São Paulo",-23.48525,E.M.E.I. PROFª DINAH GALVÃO,-46.492573,Da 767ª à 768ª; 776ª; 786ª; 793ª;,ERMELINO MATARAZZO,326
4565,JARDIM PIRAJUSSARA,"RUA FRANCISCO PEIXOTO, 54, São Paulo",-23.634728,EE. PRESIDENTE KENNEDY,-46.770687,Da 17ª à 28ª.,CAMPO LIMPO,328
6741,VILA PROGREDIOR,"AV. JORGE JOÃO SAAD, 905, São Paulo",-23.594036,COLÉGIO MIGUEL DE CERVANTES,-46.720455,Da 31ª à 46ª; 609ª;,BUTANTÃ,346
5318,JARDIM MARIA AMALIA,"RUA SATÉLITE JAPETUS, 30, São Paulo",-23.77231,EE. DAVID ZEIGER,-46.714775,Da 129ª à 143ª.,PARELHEIROS,381
9032,JARDIM SAO JOAO,"RUA PIETRO CASELLA, S/N, São Paulo",-23.66069,EE. ANTÔNIO MANOEL ALVES DE LIMA,-46.737041,Da 56ª à 71ª; 273ª; 297ª;,JARDIM SÃO LUÍS,408
5359,JARDIM BRASIL,"RUA DORÂNDIA, 158, São Paulo",-23.477671,ESCOLA ESTADUAL PROVÍNCIA DE NAGASAKI,-46.571678,Da 219ª à 232ª; 315ª;,VILA SABRINA,420
608,VILA NOVA CURUÇÁ,"RUA GAIVÃO, 177, São Paulo",-23.518352,EE. VILA NOVA CURUÇÁ,-46.420074,745ª; 749ª; 769ª; 779ª;,SÃO MIGUEL PAULISTA,247
5346,ALTO DE PINHEIROS,"AVENIDA PEDROSO DE MORAIS, 1341, São Paulo",-23.560101,COLÉGIO PALMARES,-46.695251,Da 27ª à 38ª; 244ª; 303ª;,PINHEIROS,251
4335,VILA BANDEIRANTES,"RUA ZILDA, 193, São Paulo",-23.498011,EMEF. DONA ANGELINA MAFFEI VITA,-46.661289,Da 158ª à 169ª; 521ª;,CASA VERDE,255
4933,VILA RUBI,"RUA JOAQUIM DOS SANTOS, 539, São Paulo",-23.72488,EE. JERÔNYMO MONTEIRO,-46.698521,Da 377ª à 388ª; 836ª;,CAPELA DO SOCORRO,280
273,JARDIM DA CONQUISTA,"RUA ARGÉLIA, S/N., São Paulo",-23.417179,EMEF RECANTO DOS HUMILDES,-46.746311,412ª; 455ª; 473ª;,PERUS,389
7023,VILA SEABRA,"RUA TIETÊ, 49, São Paulo",-23.490929,EE. MÁRIO KOZEL FILHO,-46.407574,Da 110ª à 127ª.,JARDIM HELENA,397
3611,JARAGUA,"AV. JERIMANDUBA, S/N, São Paulo",-23.45499,EE. PROFA. ISABEL VIEIRA DE SERPA E PAIVA,-46.747452,Da 59ª à 67ª.,JARAGUÁ,403
6510,BELA VISTA,"AV. BRIG. LUÍS ANTÔNIO, 1373, São Paulo",-23.56114,FMU (PRÉDIO 40) - BRIGADEIRO,-46.64381,Da 129ª à 130ª; 359ª; 391ª; 402ª; 409ª; 416ª; 420ª; 424ª; 430ª; 433ª; 437ª; Da 440ª à 441ª; 443ª; Da 446ª à 447ª; 492ª; Da 496ª à 497ª; 508ª;,BELA VISTA,1
8475,BELA VISTA,"AV. BRIGADEIRO LUÍS ANTONIO, 871, São Paulo",-23.5576,ANHANGUERA,-46.640758,Da 50ª à 55ª; Da 113ª à 128ª;,BELA VISTA,1
12691,HIGIENOPOLIS,"AV. HIGIENÓPOLIS, 996, São Paulo",-23.540991,COLÉGIO RIO BRANCO,-46.660751,Da 181ª à 209ª; 364ª; 434ª; 445ª; 450ª;,BELA VISTA,1
10789,LIBERDADE,"AV. LIBERDADE, 532, São Paulo",-23.883535,FECAP - LIBERDADE,-46.641064,Da 260ª à 289ª; 387ª; 404ª; 418ª;,BELA VISTA,1
9239,BELA VISTA,"AV. PAULISTA, 227, São Paulo",-23.56978,EE RODRIGUES ALVES,-46.646458,Da 28ª à 49ª; 363ª; 371ª;,BELA VISTA,1
11090,BELA VISTA,"AV. PAULISTA, 900, São Paulo",-23.56542,COLÉGIO OBJETIVO,-46.651482,Da 1ª à 27ª; 355ª; 361ª;,BELA VISTA,1
72,JARDIM QUISISANA,"RUA JEAN LACOME 78, São Paulo",-23.503552,INTERNATO VILA CONCEIÇÃO,-46.404877,359ª.,JARDIM HELENA,397
12267,LIBERDADE,"AVENIDA DA LIBERDADE, 749, São Paulo",-23.5592,FMU (PRÉDIO 17) - FACULDADE DIREITO LIBERDADE,-46.637508,Da 98ª à 112ª; Da 322ª à 329ª; Da 377ª à 378ª; 381ª; 392ª; 432ª; 452ª; 456ª; 463ª; 465ª; 468ª; 470ª; 472ª; 475ª; 477ª; 486ª;,BELA VISTA,1
8085,LIBERDADE,"AVENIDA LIBERDADE, 899, São Paulo",-23.558969,FMU (PRÉDIO 16) - LIBERDADE,-46.632881,Da 302ª à 321ª; 360ª; Da 365ª à 368ª; 384ª; Da 488ª à 489ª;,BELA VISTA,1
7259,SE,"LARGO SÃO FRANCISCO, 19, São Paulo",-23.549751,FECAP - SÃO FRANCISCO,-46.636658,Da 345ª à 354ª; 357ª; 374ª; 385ª; 395ª; 422ª; 453ª; 455ª; 467ª; 473ª; 478ª;,BELA VISTA,1
6208,SE,"LARGO SÃO FRANCISCO, 95, São Paulo",-23.549706,USP - FACULDADE DE DIREITO,-46.636829,Da 330ª à 344ª; 396ª; 415ª;,BELA VISTA,1
3681,SE,"PRAÇA DR. MÁRIO MARGARIDO, 35, São Paulo",-23.554451,EMEF DUQUE DE CAXIAS,-46.628899,399ª; 411ª; 427ª; 439ª; 442ª; 449ª; 457ª; 459ª; 461ª; 487ª; 491ª; 495ª; 507ª;,BELA VISTA,1
7865,CONSOLACAO,"RUA DA CONSOLAÇÃO, 1289, São Paulo",-23.549851,EE PROFESSORA MARINA CINTRA,-46.653419,Da 210ª à 226ª; 356ª; 369ª; Da 372ª à 373ª;,BELA VISTA,1
3088,CONSOLACAO,"RUA DA CONSOLAÇÃO, 881, São Paulo",-23.548309,PUC COGEAE,-46.649841,462ª; 464ª; 466ª; 469ª; 471ª; 474ª; 476ª; 479ª; 490ª; 504ª;,BELA VISTA,1
5944,BELA VISTA,"RUA HUMAITÁ, 480, São Paulo",-23.55724,EMEF CELSO LEITE RIBEIRO FILHO,-46.642078,Da 56ª à 70ª; 406ª;,BELA VISTA,1
18185,HIGIENOPOLIS,"RUA ITAMBÉ, 135, São Paulo",-23.546341,MACKENZIE,-46.652962,Da 140ª à 180ª; 358ª; 389ª; 398ª; 400ª; 405ª; 412ª; 417ª; 419ª; 423ª; 428ª; 431ª; 435ª; 458ª;,BELA VISTA,1
9422,CONSOLACAO,"RUA JOÃO GUIMARÃES ROSA, 111, São Paulo",-23.54953,EE CAETANO DE CAMPOS,-46.647011,Da 227ª à 251ª.,BELA VISTA,1
6318,BELA VISTA,"RUA JOÃO PASSALACQUA, 207, São Paulo",-23.560801,COLÉGIO JOÃO E RAPHAELA PASSALACQUA,-46.640831,Da 87ª à 97ª; 393ª; 410ª; 421ª; 429ª; 438ª; 460ª;,BELA VISTA,1
3836,BELA VISTA,"RUA MAJOR DIOGO, 200, São Paulo",-23.552891,EE DRA. MARIA AUGUSTA SARAIVA,-46.64333,Da 131ª à 139ª; 390ª; 413ª;,BELA VISTA,1
5345,CONSOLACAO,"RUA MARQUÊS DE PARANAGUÁ, 111, São Paulo",-23.54936,PUC - FACULDADE DE CIÊNCIAS EXATAS E TECNOLOGIA,-46.650188,Da 252ª à 259ª; 375ª; 383ª; 388ª; 408ª; 426ª; 448ª; 451ª;,BELA VISTA,1
8892,LIBERDADE,"RUA SÃO JOAQUIM, 320, São Paulo",-23.561655,EE PRESIDENTE ROOSEVELT,-46.635506,Da 290ª à 301ª; 362ª; 370ª; 376ª; Da 379ª à 380ª; 382ª; 397ª; 403ª; 414ª; 425ª; 436ª; 444ª; 454ª;,BELA VISTA,1
3396,BARRA FUNDA,"ALAMEDA BARÃO DE LIMEIRA,1379, São Paulo",-23.530251,INSTITUTO EDUCACIONAL BONI CONSILII,-46.65102,Da 76ª à 84ª; 355ª; 365ª;,PERDIZES,2
6070,SANTA CECILIA,"ALAMEDA BARROS, 539, São Paulo",-23.536669,EXTERNATO CASA PIA,-46.656044,Da 173ª à 188ª; 419ª;,PERDIZES,2
2289,CAMPOS ELISEOS,"ALAMEDA CLEVELAND, 331, São Paulo",-23.532471,ESCOLA ESTADUAL JOÃO KOPKE,-46.641659,372ª; 377ª; 409ª; 430ª; 462ª; 484ª; 502ª;,PERDIZES,2
7538,CAMPOS ELISEOS,"ALAMEDA DINO BUENO, 383, São Paulo",-23.53137,LICEU CORAÇÃO DE JESUS,-46.64373,Da 111ª à 135ª; 360ª; 364ª;,PERDIZES,2
6239,AGUA BRANCA,"AV. FRANCISCO MATARAZZO, 364, São Paulo",-23.53005,UNINOVE - UNIVERSIDADE NOVE DE JULHO,-46.666851,Da 85ª à 94ª; 361ª; 439ª; 454ª; 467ª; 486ª; 498ª; 505ª; 517ª; 522ª;,PERDIZES,2
10227,AGUA BRANCA,"AV. FRANCISCO MATARAZZO, 913, São Paulo",-23.527666,COLÉGIO DAS AMÉRICAS,-46.671692,Da 1ª à 27ª; 342ª; 369ª; 435ª;,PERDIZES,2
5903,SANTA CECILIA,"AVENIDA ANGÉLICA, 352, São Paulo",-23.53606,COLÉGIO OSWALDO CRUZ,-46.654221,Da 189ª à 203ª; 450ª;,PERDIZES,2
3814,AGUA BRANCA,"AVENIDA FRANCISCO MATARAZZO, 385, São Paulo",-23.530167,ASSOCIAÇÃO CÍVICA FEMININA,-46.667194,Da 64ª à 69ª; 354ª; Da 356ª à 357ª; 359ª; 367ª; 520ª;,PERDIZES,2
6682,HIGIENOPOLIS,"AVENIDA HIGIENÓPOLIS, 983, São Paulo",-23.540833,COLÉGIO NOSSA SENHORA DO SION,-46.660747,375ª; 387ª; 395ª; 400ª; 405ª; 414ª; 421ª; 437ª; 446ª; 461ª; 464ª; 468ª; 471ª; 475ª; Da 478ª à 479ª; 482ª; 485ª; 503ª;,PERDIZES,2
7044,BELA VISTA,"RUA TREZE DE MAIO, 267, São Paulo",-23.568393,EE MARIA JOSÉ,-46.641083,Da 71ª à 86ª; 394ª; 401ª; 407ª; 493ª;,BELA VISTA,1
9086,HIGIENOPOLIS,"RUA ALAGOAS, 903, São Paulo",-23.544741,FAAP - FUNDAÇÃO ARMANDO ÁLVARES PENTEADO,-46.662479,Da 136ª à 152ª; 363ª; 385ª; 442ª; 455ª; 460ª; 488ª; 490ª; 492ª; 518ª;,PERDIZES,2
5794,SUMARE,"RUA ALEGRETE, 168, São Paulo",-23.54796,COLÉGIO NOTRE DAME,-46.680119,Da 260ª à 270ª; 371ª; 428ª; 438ª; 441ª; 452ª;,PERDIZES,2
727,BARRA FUNDA,"RUA ANHANGUERA, 484, São Paulo",-23.523232,CENTRO EDUCACIONAL E ESPORTIVO ''RAUL TABAJARA'',-46.652702,373ª; 382ª; 432ª;,PERDIZES,2
