aptos_por_local,bairro,endereco,lat,local_de_votacao,long,secoes_eleitorais,zona_eleitoral_nome,zona_eleitoral_nro
4161,VILA PARANAGUÁ,"RUA GENERAL COSTA CAMPOS, 280, São Paulo",-23.49704,E.E. PROF. UMBERTO CONTE CHECCHIA,-46.47517,Da 48ª à 52ª; 478ª; 497ª; 513ª; 530ª; 551ª; 761ª;,ERMELINO MATARAZZO,326
4882,JARDIM MATARAZZO,"RUA JACIRA FERRARI DE OLIVEIRA, 39, São Paulo",-23.487141,E.E. PROF. LÚCIO DE CARVALHO MARQUES,-46.474461,Da 28ª à 34ª; 491ª; 494ª; 500ª; 516ª; 547ª; 590ª;,ERMELINO MATARAZZO,326
7009,PARQUE BOTURUSSU,"RUA PAULO BIFANO ALVES, 658, São Paulo",-23.503141,E.M.E.F. OCTÁVIO MANGABEIRA,-46.483982,Da 68ª à 85ª; 577ª; 629ª;,ERMELINO MATARAZZO,326
2587,VILA CÍSPER,"RUA PEDRA LAVRADA, 575, São Paulo",-23.49861,E.M.E.F. PROF. JOÃO FRANZOLIN NETO,-46.492458,614ª; 655ª; 672ª; 685ª; 708ª; 742ª; 791ª; 803ª;,ERMELINO MATARAZZO,326
1131,PARQUE BOTURUSSU,"RUA PROF. ANTONIO DE CASTRO LOPES, 613, São Paulo",-23.50107,COLÉGIO INTEGRAÇÃO,-46.478271,719ª; 753ª; 778ª;,ERMELINO MATARAZZO,326
4024,VILA ZAT,"RUA MONSENHOR MANOEL GOMES, 306, São Paulo",-23.478525,EE. DOUTOR JOAQUIM SILVADO,-46.710667,Da 455ª à 457ª; Da 459ª à 460ª; 463ª; Da 466ª à 467ª; 512ª; 535ª; 545ª;,NOSSA SENHORA DO Ó,327
4450,PARQUE BOTURUSSU,"RUA PROF. ANTONIO DE CASTRO LOPES, 930, São Paulo",-23.499304,E.E. PROFª THEREZINHA ARANHA MANTELLI,-46.478596,Da 90ª à 92ª; 454ª; Da 456ª à 458ª; 461ª; 466ª; 468ª; Da 471ª à 472ª; 747ª;,ERMELINO MATARAZZO,326
3881,PONTE RASA,"RUA PROF. JOSÉ DE SOUZA, 173, São Paulo",-23.506556,COLÉGIO FLORESTA,-46.492069,634ª; 654ª; 663ª; 673ª; 684ª; 696ª; 712ª; 722ª; 740ª; 757ª;,ERMELINO MATARAZZO,326
1151,JARDIM VERÔNIA,"RUA RITA DE SOUZA, 30, São Paulo",-23.48918,C.E.I. JARDIM VERONIA,-46.488457,772ª; 777ª; 785ª;,ERMELINO MATARAZZO,326
3860,JARDIM MATARAZZO,"RUA VILA NOVA DE SANTA CRUZ, S/N, São Paulo",-23.49015,E.E. MARIA JOVITA,-46.466351,612ª; 631ª; 646ª; 664ª; 694ª; 728ª; 756ª; 770ª; Da 782ª à 783ª;,ERMELINO MATARAZZO,326
2826,FREGUESIA DO O,"AVENIDA ITABERABA , 669, São Paulo",-23.49523,COLEGIO BEKA SC LTDA,-46.697731,525ª; 529ª; 532ª; 534ª; 540ª; Da 543ª à 544ª; 561ª;,NOSSA SENHORA DO Ó,327
4619,NOSSA SENHORA DO O,"AVENIDA ITABERABA, 145, São Paulo",-23.49987,EE. PADRE MANOEL DE NÓBREGA,-46.697571,Da 209ª à 220ª.,NOSSA SENHORA DO Ó,327
2134,MOINHO VELHO,"AVENIDA MINISTRO PETRÔNIO PORTELA, 11, São Paulo",-23.49753,CENTRO DE ENSINO INTEGRADO WELLINGTON,-46.705231,526ª; 533ª; 541ª; 555ª; 560ª; 566ª;,NOSSA SENHORA DO Ó,327
3572,VILA ALBERTINA,"PRAÇA ITÁLICO ANCONA LOPES, 257, São Paulo",-23.49653,EE. REGENTE FEIJÓ,-46.690391,Da 361ª à 369ª; 554ª;,NOSSA SENHORA DO Ó,327
6875,VILA PALMEIRAS,"R. SANTA ÂNGELA, 50, São Paulo",-23.498461,EMEI. NAIR CORREA BUARQUE,-46.686047,476ª; 489ª; 498ª; 511ª; 522ª;,NOSSA SENHORA DO Ó,327
851,VILA ALBERTINA,"RUA ANTONIO PIRES, 663, São Paulo",-23.49794,NÚCLEO CORAÇÃO MATERNO,-46.691841,524ª; 538ª; 556ª;,NOSSA SENHORA DO Ó,327
4886,JARDIM SAO JOSE,"RUA ARNALDO ALVERNAZ NUNES, 320, São Paulo",-23.485653,EMEF. GENERAL LIBERATO BITTENCOURT,-46.712917,475ª; 484ª; 486ª; 491ª; 501ª; 504ª; 510ª; 518ª; 528ª; 539ª; 557ª; 562ª; 565ª;,NOSSA SENHORA DO Ó,327
3612,VILA MIRANTE,"RUA BERNARDO ROLIM DE MOURA, 129, São Paulo",-23.467661,EE. PROF. GERALDO HOMERO DE FRANÇA OTTONI,-46.719952,480ª; 488ª; 497ª; 505ª; 515ª; 520ª; 546ª; 558ª; 564ª; 567ª;,NOSSA SENHORA DO Ó,327
1841,VILA ALBERTINA,"RUA BONIFÁCIO CUBAS, 356, São Paulo",-23.499729,EMEI. MANOEL PRETO,-46.69426,473ª; 478ª; 483ª; 487ª; 493ª;,NOSSA SENHORA DO Ó,327
3179,FREGUESIA DO O,"RUA BONIFÁCIO CUBAS, 490, São Paulo",-23.498699,INSTITUTO DE ENSINO JEQUITIBÁ S/C LTDA,-46.694508,Da 204ª à 208ª; Da 408ª à 409ª; 458ª; 549ª;,NOSSA SENHORA DO Ó,327
1311,FREGUESIA DO O,"RUA CALIXTO DE ALMEIDA, 442A, São Paulo",-23.48904,EMEI JARDIM MONJOLO I,-46.70092,474ª; 481ª; 490ª; 500ª;,NOSSA SENHORA DO Ó,327
4582,VILA ALBERTINA,"RUA CAROLINA MARIA DO CARMO, S/N, São Paulo",-23.50384,EE. PROF. ANTONIO EMÍLIO DE SOUZA PENNA,-46.692169,Da 192ª à 197ª; Da 247ª à 253ª;,NOSSA SENHORA DO Ó,327
4123,VILA ZAT,"RUA CONCEIÇÃO DO NORTE, 906, São Paulo",-23.4741,EE. JORNALISTA CARLOS FREDERICO WERNECK LACERDA,-46.715671,462ª; 465ª; Da 468ª à 471ª; 477ª; 521ª; 530ª; 536ª; 542ª;,NOSSA SENHORA DO Ó,327
5996,VILA MARINA,"RUA JACARÉ COPAÍBA, 33, São Paulo",-23.483057,EE. ALMIRANTE MARQUÊS DE TAMANDARÉ,-46.701126,Da 145ª à 159ª; 547ª;,NOSSA SENHORA DO Ó,327
4754,MOINHO VELHO,"RUA JOÃO CORDEIRO, 929, São Paulo",-23.4912,EE. PROF. MILTON DA SILVA RODRIGUES,-46.704945,Da 339ª à 346ª; Da 440ª à 441ª; 447ª; 452ª; 553ª;,NOSSA SENHORA DO Ó,327
2258,FREGUESIA DO O,"RUA MANOEL MADRUGA, 104, São Paulo",-23.495708,COLÉGIO ORLANDO GARCIA DA SILVEIRA S/C LTDA,-46.698612,503ª; 506ª; 509ª; Da 513ª à 514ª; 519ª; 523ª;,NOSSA SENHORA DO Ó,327
6720,FREGUESIA DO O,"RUA MANUEL MADRUGA, 205, São Paulo",-23.49588,EE. PROF. JÁCOMO STAVALE,-46.699944,Da 230ª à 238ª; Da 375ª à 378ª; Da 384ª à 387ª; 550ª;,NOSSA SENHORA DO Ó,327
627,VILA NOSSA SENHORA DO RETIRO,"RUA MARGARIDA RAMALHO (DR. PEDRO DE MUSTRE PORTUGAL, 265), São Paulo",-23.471218,EE. NOSSA SENHORA DO RETIRO,-46.721149,Da 568ª à 571ª; Da 574ª à 575ª;,NOSSA SENHORA DO Ó,327
4014,MOINHO VELHO,"RUA MOINHO VELHO, 355, São Paulo",-23.49416,EE. MATHIAS AIRES,-46.70789,Da 329ª à 338ª; 552ª;,NOSSA SENHORA DO Ó,327
5868,JARDIM MONJOLO,"RUA NAZÁRIO PAGANO, 225, São Paulo",-23.492081,EE. PASQUALE PECCICACCO,-46.697498,Da 254ª à 262ª; Da 284ª à 289ª; 551ª;,NOSSA SENHORA DO Ó,327
2271,JARDIM MARILIZA,"RUA PADRE FELICIANO DOMINGUES, 182, São Paulo",-23.483776,EMEI. VINTE E CINCO DE JANEIRO,-46.703457,482ª; 495ª; 507ª; 516ª; 531ª; 563ª;,NOSSA SENHORA DO Ó,327
3797,VILA MARINA,"RUA PRAIA DO TUMIARÚ, 320, São Paulo",-23.48691,EE. PROF. PAULO TRAJANO DA SILVEIRA SANTOS,-46.707668,472ª; 479ª; 485ª; 492ª; 499ª; 508ª; 517ª; 527ª; 537ª; 559ª;,NOSSA SENHORA DO Ó,327
4727,JARDIM SABARÁ,"RUA JUARI, 835, São Paulo",-23.686188,EMEF. DOUTOR ANTONIO CARLOS DE ABREU SODRÉ,-46.682282,Da 118ª à 129ª.,PEDREIRA,418
7666,NOSSA SENHORA DO O,"RUA PROF. JOÃO MACHADO, 511, São Paulo",-23.497854,EE. PROF. AUGUSTO RIBEIRO DE CARVALHO,-46.702931,Da 221ª à 229ª; Da 239ª à 246ª; Da 404ª à 407ª; 428ª;,NOSSA SENHORA DO Ó,327
4003,VILA MARINA,"RUA RAFAEL ALVES, 295, São Paulo",-23.478531,EMEF. ÉRICO VERÍSSIMO,-46.706394,Da 160ª à 169ª; 548ª;,NOSSA SENHORA DO Ó,327
6875,VILA PALMEIRAS,"RUA SANTA ÂNGELA, 50, São Paulo",-23.498461,EMEF. DOUTOR ELIAS DE SIQUEIRA CAVALCANTI,-46.686047,Da 347ª à 360ª.,NOSSA SENHORA DO Ó,327
4990,ITABERABA,"RUA SANTA LÚCIA FILIPPINI, 104, São Paulo",-23.487845,COLÉGIO SANTA LÚCIA FILIPPINI,-46.692371,Da 271ª à 283ª; 464ª;,NOSSA SENHORA DO Ó,327
5208,ITABERABA,"RUA SANTA LÚCIA FILIPPINI, 65, São Paulo",-23.487522,EE. PROF. JOAQUIM LUIZ DE BRITO,-46.692604,Da 290ª à 304ª.,NOSSA SENHORA DO Ó,327
5493,PARQUE MONTEIRO SOARES,"RUA TOMÁS RAMOS JORDÃO, 259, São Paulo",-23.48988,EMEF. PLÍNIO AYROSA,-46.691418,Da 263ª à 270ª; 380ª; Da 393ª à 398ª;,NOSSA SENHORA DO Ó,327
6357,JARDIM MARIA SAMPAIO,"AVENIDA AUGUSTO BARBOSA TAVARES, 716, São Paulo",-23.643133,EMEF. FAGUNDES VARELLA,-46.787258,Da 438ª à 448ª; 490ª; 504ª; 516ª; 529ª; 544ª; 826ª;,CAMPO LIMPO,328
19965,CAMPO LIMPO,"ESTRADA DO CAMPO LIMPO, 3.677, São Paulo",-23.648745,ACADEMIA PAULISTA ANCHIETA UNIBAN,-46.760227,646ª; 661ª; 670ª; 676ª; 692ª; 697ª; 700ª; 707ª; 711ª; 715ª; 722ª; 728ª; 739ª; 741ª; 744ª; Da 746ª à 750ª; Da 753ª à 755ª; Da 761ª à 765ª; 768ª; Da 770ª à 771ª; 773ª; Da 775ª à 776ª; 781ª; 785ª; 790ª; 795ª; 799ª; 802ª; 804ª; 807ª; 810ª; 813ª; 818ª; Da 832ª à 833ª; 849ª; 854ª; 858ª; 869ª; 874ª; 884ª; Da 889ª à 890ª; Da 892ª à 893ª; 895ª;,CAMPO LIMPO,328
6610,VILA NAIR,"ESTRADA DOS MIRANDAS, 40, São Paulo",-23.615732,EE. COMENDADOR MIGUEL MALUHY,-46.755833,647ª; 657ª; 665ª; 673ª; 694ª; 698ª; 706ª; 712ª; 723ª; 729ª; 734ª; 742ª; 756ª; 772ª; 787ª; 806ª; 819ª;,CAMPO LIMPO,328
4668,JARDIM OLINDA,"RUA CANORI, 30, São Paulo",-23.62908,EE. DR. HÉLIO MOTTA,-46.755741,585ª; 597ª; 615ª; 627ª; 639ª; 651ª; 664ª; 688ª; 828ª; 839ª; 844ª; 865ª; 879ª; 885ª;,CAMPO LIMPO,328
6917,JARDIM MARIA SAMPAIO,"RUA CANTANHEDE, 190, São Paulo",-23.643688,EE. DEPUTADO HUGO LACORTE VITALE,-46.786072,587ª; 591ª; 598ª; 608ª; 614ª; 620ª; 629ª; 636ª; 655ª; 667ª; 675ª; 704ª; 719ª; 830ª; 840ª; 846ª; 862ª; 876ª;,CAMPO LIMPO,328
6284,PARQUE ARARIBA,"RUA DR. ABELARDO DA CUNHA LOBO, 348, São Paulo",-23.640375,EMEF. DES. PAULO COLOMBO PEREIRA DE QUEIROZ,-46.750107,Da 330ª à 342ª; 638ª; 825ª; 857ª;,CAMPO LIMPO,328
2754,PARQUE REGINA,"RUA FRANCISCO SOARES, 487, São Paulo",-23.63464,EMEF. PARQUE REGINA,-46.749008,Da 851ª à 852ª; 856ª; 860ª; 868ª; 873ª; 877ª; 880ª; 882ª; 886ª; 888ª; 891ª; 894ª;,CAMPO LIMPO,328
4585,PARQUE ARARIBA,"RUA FRANCISCO SOARES, 51, São Paulo",-23.637295,EMEF. 22 DE MARÇO,-46.749729,777ª; Da 783ª à 784ª; 788ª; 791ª; 794ª; 798ª; 800ª; 803ª; 808ª; 812ª; 835ª;,CAMPO LIMPO,328
6730,JARDIM CATANDUVA,"RUA FREI MARTINHO BURNIER, 50, São Paulo",-23.635281,EMEF. CEL. PALIMÉRCIO DE REZENDE,-46.763245,Da 44ª à 58ª; 679ª; 821ª; 843ª;,CAMPO LIMPO,328
5302,JARDIM CATANDUVA,"RUA GIOVANNI AMADEO, 187, São Paulo",-23.63872,EMEF. PREFEITO ADHEMAR DE BARROS,-46.76104,Da 59ª à 70ª; 822ª; 838ª;,CAMPO LIMPO,328
7699,JARDIM LEONIDAS MOREIRA,"RUA IBI, 18, São Paulo",-23.643669,EE. PROF. MESSIAS FREIRE,-46.775822,Da 191ª à 208ª; 483ª; 824ª;,CAMPO LIMPO,328
4574,JARDIM ELIZABETH,"RUA JANUARIO DA CUNHA BARBOSA, 413, São Paulo",-23.63916,EE. DIB AUDI,-46.776699,501ª; Da 509ª à 510ª; 515ª; 526ª; 536ª; 546ª; 552ª; 650ª; 681ª; 829ª; 848ª;,CAMPO LIMPO,328
5314,JARDIM UMARIZAL,"RUA JARACATIA, 941, São Paulo",-23.622864,EE. DR. FRANCISCO BRASILIENSE FUSCO,-46.751621,642ª; 693ª; 716ª; 743ª; 759ª; 769ª; 782ª; 796ª; 811ª; 817ª; 831ª; 853ª; 867ª; 875ª; 881ª; 887ª;,CAMPO LIMPO,328
3022,JARDIM PIRACUAMA,"RUA JOÃO RODRIGUES DE MOURA, 16, São Paulo",-23.647062,EMEF. MODESTO SCAGLIUSI,-46.762058,778ª; 786ª; 792ª; 801ª; 809ª; 816ª; 836ª; 870ª;,CAMPO LIMPO,328
5806,JARDIM BOM REFUGIO,"RUA JOSÉ VIRIATO DE CASTRO, 63, São Paulo",-23.633062,EMEF. LEONARDO VILLAS BOAS,-46.773708,Da 1ª à 16ª.,CAMPO LIMPO,328
5223,JARDIM UMUARAMA,"RUA JUAN ALDAMA, 100, São Paulo",-23.644991,EE. MOACYR DE CASTRO FERRAZ,-46.768375,Da 420ª à 428ª; 491ª; 505ª; 512ª; 528ª; 678ª;,CAMPO LIMPO,328
6741,JARDIM MARTINICA,"RUA KUNITO MIYASAKA, 54, São Paulo",-23.629505,EMEF. MAURÍCIO SIMÃO,-46.76857,Da 29ª à 43ª; 635ª; 820ª; 841ª;,CAMPO LIMPO,328
5869,JARDIM PIRACUAMA,"RUA LIRA CEARENSE, 869, São Paulo",-23.64023,EE. PROF. DOUTOR CLÓVIS DE OLIVEIRA,-46.755871,Da 469ª à 475ª; 487ª; 533ª; 617ª; 628ª; 637ª; 680ª; 827ª; 845ª;,CAMPO LIMPO,328
5338,JARDIM UMUARAMA,"RUA LUSTER, 216, São Paulo",-23.646347,EE. FERNANDO GASPARIAN,-46.770882,625ª; 652ª; Da 757ª à 758ª; 767ª; 779ª; 793ª; 805ª; 815ª; 834ª; 837ª; 855ª; 861ª; 872ª; 878ª;,CAMPO LIMPO,328
6392,PARQUE REGINA,"RUA MELO COUTINHO, 69, São Paulo",-23.63493,EMEF. ZULMIRA CAVALHEIRO FAUSTINO,-46.753941,343ª; 499ª; 511ª; 521ª; 527ª; 541ª; 551ª; 559ª; 564ª; 570ª; 576ª; 590ª; 596ª; 603ª; 607ª; 622ª;,CAMPO LIMPO,328
7040,JARDIM VALE DAS VIRTUDES,"RUA NAIMPUR, 80, São Paulo",-23.651131,EE. SANTA ROSA DE LIMA,-46.777821,644ª; 669ª; 691ª; 701ª; 708ª; 720ª; 730ª; 738ª; 745ª; Da 751ª à 752ª; 760ª; 766ª; 774ª; 780ª; 789ª; 797ª; 814ª;,CAMPO LIMPO,328
6349,JARDIM PIRACUAMA,"RUA PROF. OSCAR CAMPIGLIA, 529, São Paulo",-23.64097,EE. DUGLAS TEIXEIRA MONTEIRO,-46.7617,Da 71ª à 80ª; 480ª; 640ª; 660ª; 685ª; 842ª; 850ª; 859ª; 883ª;,CAMPO LIMPO,328
3574,REAL PARQUE,"AV. DUQUESA DE GOIÁS, 262, São Paulo",-23.609732,CENTRO EDUCACIONAL OBJETIVO,-46.704002,530ª; 551ª; 557ª; Da 561ª à 562ª; 573ª; 579ª; 581ª; 589ª;,BUTANTÃ,346
2770,FERREIRA,"AV. PIRAJUSSARA, 4359, São Paulo",-23.596451,COLÉGIO ITACA,-46.7463,529ª; 540ª; 554ª; 564ª; 577ª; 586ª; 592ª;,BUTANTÃ,346
2758,JARDIM MONTE KEMEL,"AV. PROF. GIOIA MARTINS, 686, São Paulo",-23.600882,EE. PROFA. ADALGIZA SEGURADO DA SILVEIRA,-46.735195,516ª; 523ª; 533ª; 544ª; 553ª; 565ª; 571ª;,BUTANTÃ,346
3739,MORUMBI,"AVENIDA MORUMBI, 501, São Paulo",-23.579281,FACULDADES METROPOLITANAS UNIDAS - CAMPUS MORUMBI,-46.70583,Da 21ª à 30ª; 623ª;,BUTANTÃ,346
4297,CIDADE JARDIM,"PRAÇA  PROF.  AMÉRICO DE MOURA, 101, São Paulo",-23.586126,ESCOLA CIDADE JARDIM PLAYPEN,-46.698357,Da 476ª à 485ª; 593ª;,BUTANTÃ,346
4364,VILA SONIA,"PRAÇA DR. JOSÉ ÓRIA, S/N, São Paulo",-23.5949,EMEF. DESEMBARGADOR THEODOMIRO DIAS,-46.731651,Da 520ª à 521ª; 524ª; 527ª; 534ª; 545ª; 563ª; 568ª; 639ª; 643ª; 648ª; 652ª;,BUTANTÃ,346
1578,VILA SONIA,"RUA ABRAÃO KALIL REZEK, 45, São Paulo",-23.574465,EMEI. DES. DALMO DO VALLE NOGUEIRA,-46.745163,597ª; 621ª; 627ª; 632ª;,BUTANTÃ,346
3156,JARDIM JUSSARA,"RUA ALFREDO MENDES DA SILVA, 55, São Paulo",-23.60272,ESCOLA DA VILA,-46.745255,Da 411ª à 414ª; 473ª; 512ª; 583ª; 620ª;,BUTANTÃ,346
5139,JARDIM JUSSARA,"RUA ALMIRANTE ARISTIDES GUILHEM, 38, São Paulo",-23.60363,EE. PROFA. JACYRA MOYA MARTINS CARVALHO,-46.746792,Da 79ª à 90ª; 618ª;,BUTANTÃ,346
3944,VILA SONIA,"RUA ANDRÉ SARAIVA, 860, São Paulo",-23.59635,EMEF. DES. ARTHUR WHITAKER,-46.73558,430ª; 438ª; 441ª; 445ª; 452ª; 457ª; 459ª; 461ª; 465ª; 606ª;,BUTANTÃ,346
151,JARDIM ADHEMAR DE BARROS,"RUA ANTONIO MARIANI, 425, São Paulo",-23.576218,CENTRO INTEGRADO DE EDUCAÇÃO DE JOVENS E ADULTOS CIEJA,-46.71846,603ª.,BUTANTÃ,346
1974,JARDIM DRACENA,"RUA BARTOLOMEO BON, 105, São Paulo",-23.59399,EMEI. FERNANDO PESSOA,-46.759171,539ª; 552ª; 570ª; 630ª; 641ª;,BUTANTÃ,346
6038,JARDIM GUAIRACA,"RUA ALCAÇUZ, 130, São Paulo",-23.60426,EMEF. ALVARES DE AZEVEDO,-46.538399,Da 155ª à 170ª.,SAPOPEMBA,350
4359,INSTITUTO DE PREVIDENCIA,"RUA ANTONIO ADIB CHAMMAS, 124, São Paulo",-23.591677,EE. DR. KYRILLOS,-46.72554,Da 220ª à 231ª.,BUTANTÃ,346
3584,FERREIRA,"RUA CAMINHO DO ENGENHO, 478, São Paulo",-23.59679,COLÉGIO FRANCISCANO JOAO XXIII,-46.74464,519ª; 522ª; 531ª; 541ª; 549ª; 556ª; 559ª; 582ª; 622ª; 654ª;,BUTANTÃ,346
4346,PARAISOPOLIS,"RUA CLEMENTINE BRENNE, 30, São Paulo",-23.60782,COLÉGIO VISCONDE DE PORTO SEGURO - UNIDADE I,-46.720886,423ª; Da 425ª à 429ª; 446ª; 532ª; 548ª; 555ª; 558ª;,BUTANTÃ,346
4399,FAZENDA MORUMBI,"RUA COLÉGIO PIO XII, 233, São Paulo",-23.618759,COLÉGIO FRANCISCANO PIO XII,-46.712978,Da 492ª à 501ª; 610ª;,BUTANTÃ,346
4375,VILA PROGREDIOR,"RUA DOM ARMANDO LOMBARDI, 223, São Paulo",-23.587408,EE. SENADOR ADOLFO GORDO,-46.720863,Da 385ª à 394ª; 617ª;,BUTANTÃ,346
4318,INSTITUTO DE PREVIDENCIA,"RUA DOMINGOS BARBIERI, 350, São Paulo",-23.57897,EE. VIRGÍLIA RODRIGUES ALVES DE CARVALHO PINTO,-46.720509,Da 210ª à 219ª; 616ª;,BUTANTÃ,346
5624,VILA INAH,"RUA ÉDEN, 100, São Paulo",-23.589548,EE. DONA ANA ROSA DE ARAÚJO,-46.726994,Da 372ª à 384ª; 502ª;,BUTANTÃ,346
3929,JARDIM JAQUELINE,"RUA FRANCISCO LEITE ESQUERDO, 310, São Paulo",-23.595181,EMEF. VIANNA MOOG,-46.754868,518ª; 525ª; 538ª; 543ª; 547ª; 567ª; 578ª; 588ª; 600ª; 633ª; 651ª;,BUTANTÃ,346
3163,JARDIM PERI PERI,"RUA GEREMIA LUNARDELLI, 145, São Paulo",-23.585125,EE. ALCIDES DA COSTA VIDIGAL,-46.736454,515ª; 537ª; 546ª; 560ª; 576ª; 585ª; 599ª; 635ª;,BUTANTÃ,346
3585,CAXINGUI,"RUA JOSÉ JANNARELLI, 621, São Paulo",-23.59025,COLÉGIO ANTOINE SAINT EXUPÉRY S/C LTDA,-46.71656,Da 395ª à 399ª; 575ª; 604ª; 628ª; 640ª;,BUTANTÃ,346
4794,VILA MORSE,"RUA LOURENÇO DE AZEVEDO, 149, São Paulo",-23.59671,EE. PROF. ADOLFO TRIPOLI,-46.72987,Da 415ª à 422ª; 469ª; 510ª; 514ª; 615ª;,BUTANTÃ,346
3976,REAL PARQUE,"RUA MATTIA FILIZZOLA, 76, São Paulo",-23.608387,EMEF.JOSÉ DE ALCÂNTARA MACHADO FILHO,-46.70483,503ª; 506ª; 509ª; 511ª; 513ª; 517ª; 526ª; 569ª; 591ª; 602ª;,BUTANTÃ,346
3588,JARDIM EVEREST,"RUA MIRAGAIA, 158, São Paulo",-23.574062,COLÉGIO JOANA D'ARC,-46.707798,Da 486ª à 491ª; 566ª; 580ª; 584ª; 587ª; 590ª; 598ª;,BUTANTÃ,346
5534,JARDIM CELESTE,"RUA NATAL PIGASSI, 787, São Paulo",-23.597782,EMEF. TARSILA DO AMARAL,-46.756615,Da 91ª à 103ª; 608ª;,BUTANTÃ,346
1451,REAL PARQUE,"RUA PAULO BOURROUL, 100, São Paulo",-23.61009,EMEI. PERO NETO,-46.703041,594ª; 625ª; 638ª; 647ª;,BUTANTÃ,346
2394,JARDIM LONDRINA,"RUA PAULO SÉRGIO MACEDO, 210 - JARDIM LAR SÃO PAULO, São Paulo",-23.610578,COLÉGIO GUILHERME DUMONT VILLARES,-46.741421,596ª; 601ª; 624ª; 631ª; 636ª; 646ª; 653ª;,BUTANTÃ,346
4401,JARDIM MONTE KEMEL,"RUA RUBENS GRISOLIA, 65, São Paulo",-23.603401,EE. PROF. PEDRO FONSECA,-46.7402,Da 57ª à 67ª.,BUTANTÃ,346
5553,JARDIM COLOMBO,"RUA SANTO AMÉRICO, 275, São Paulo",-23.604429,COLÉGIO SANTO AMÉRICO,-46.7276,Da 47ª à 56ª; 528ª; 535ª; 542ª; 550ª; 656ª;,BUTANTÃ,346
5150,JARDIM COLOMBO,"RUA THEO DUTRA, 33, São Paulo",-23.59796,EE. PROF. ANDRONICO DE MELLO,-46.731811,Da 400ª à 410ª; 572ª; 637ª;,BUTANTÃ,346
3836,CIDADE PATRIARCA,"AVENIDA ANTONIO ESTEVÃO DE CARVALHO, 1778, São Paulo",-23.527889,EE PROF. LUIZ ANTONIO FRAGOSO,-46.50745,214ª; 221ª; 224ª; 231ª; 235ª; 241ª; 247ª; 252ª; 301ª; 321ª;,VILA MATILDE,347
3715,JARDIM SAO JOAO,"AVENIDA DOUTOR BERNARDINO BRITO FONSECA DE CARVALHO, 1549/1461, São Paulo",-23.546236,COLÉGIO REINO DO ENSINO - IED,-46.504211,Da 169ª à 181ª.,VILA MATILDE,347
4993,JARDIM MARINGA,"AVENIDA ITAQUERA,  2417, São Paulo",-23.549662,EE DEP. ASTOLFO ARAUJO,-46.499329,216ª; 223ª; 228ª; 232ª; 236ª; 242ª; Da 244ª à 246ª; 251ª; 254ª; 260ª; 262ª;,VILA MATILDE,347
1082,JARDIM MARINGA,"AVENIDA MENDONÇA DRUMOND,902, São Paulo",-23.553209,EMEF.  ASSAD ABDALA,-46.517746,408ª; 424ª; 437ª; 455ª;,VILA MATILDE,347
3782,ARTUR ALVIM,"AVENIDA PADRE SENA FREITAS, 196, São Paulo",-23.544435,EE OSWALDO ARANHA BANDEIRA DE MELLO,-46.48494,320ª; 342ª; 360ª; 377ª; 382ª; 394ª; 405ª; 413ª; 440ª; 444ª; 458ª;,VILA MATILDE,347
2389,MORUMBI,"RUA DR. JOSÉ GUSTAVO, 75, São Paulo",-23.588216,ASSOCIAÇÃO EDUCACIONAL EUGÊNIO MONTALE,-46.729832,595ª; 626ª; 634ª; 642ª; Da 644ª à 645ª; 650ª; 655ª;,BUTANTÃ,346
5107,JARDIM HERCILIA,"AVENIDA PROFESSOR XAVIER DE LIMA, 644, São Paulo",-23.543964,EMEF. HUMBERTO CAMPOS,-46.508034,Da 182ª à 194ª.,VILA MATILDE,347
5811,VILA TALARICO,"AVENIDA WALDEMAR CARLOS PEREIRA, 452, São Paulo",-23.543413,EE JOSÉ TALARICO,-46.521339,Da 136ª à 150ª.,VILA MATILDE,347
3956,CIDADE PATRIARCA,"PRAÇA ARARUVA, S/N, São Paulo",-23.5347,EMEF. VISCONDE DE CAIRU,-46.499901,266ª; 275ª; 285ª; 289ª; 308ª; 322ª; 339ª; 359ª; 373ª; 434ª; 459ª;,VILA MATILDE,347
4258,JARDIM SANTA TEREZINHA (ZONA LESTE),"RUA  ANTONIO LOMBARDO, 140, São Paulo",-23.573563,EE JORGE DUPRAT FIGUEIREDO,-46.499035,319ª; 334ª; 350ª; 361ª; 372ª; 379ª; 389ª; 396ª; 418ª; 425ª; 439ª; 460ª;,VILA MATILDE,347
6776,VILA TALARICO,"RUA BENTO QUIRINO, 467, São Paulo",-23.54467,COLÉGIO DA POLÍCIA MILITAR - UNIDADE VILA TALARICO,-46.51001,Da 151ª à 152ª; Da 348ª à 349ª; 357ª; 362ª; 368ª; 378ª; 380ª; 386ª; 391ª; 393ª; 395ª; 402ª; 415ª; 428ª; 450ª; 453ª;,VILA MATILDE,347
3406,JARDIM BRASILIA,"RUA BENTO TEIXEIRA, 100, São Paulo",-23.564211,EMEF. EDUARDO PRADO,-46.493271,281ª; 291ª; 315ª; 335ª; 353ª; 369ª; 381ª; 398ª; 416ª;,VILA MATILDE,347
2685,JARDIM MARILIA,"RUA BOM JESUS DO MONTE, S/N, São Paulo",-23.565901,EE IVO BANDONI,-46.495392,303ª; 324ª; 341ª; 375ª; 409ª; 423ª; 452ª; 456ª; 462ª;,VILA MATILDE,347
1934,JARDIM HERCILIA,"RUA COROATA, 540, São Paulo",-23.540512,EE POETA  MENOTTI  DEL PICCHIA,-46.505466,135ª; 302ª; 332ª; 370ª; 410ª; 433ª;,VILA MATILDE,347
4264,JARDIM MARINGA,"RUA CUSTODIO LOBO, 29, São Paulo",-23.55236,EE PROF. OLGA MARINOVIC DORO,-46.514332,217ª; 222ª; 227ª; 230ª; 233ª; 240ª; Da 248ª à 249ª; 253ª; 296ª; 326ª; 465ª;,VILA MATILDE,347
3798,ARTUR ALVIM,"RUA DESEMBARGADOR ROCHA PORTELA,464, São Paulo",-23.538521,EMEF. ARTUR ALVIM,-46.49316,Da 111ª à 120ª.,VILA MATILDE,347
5984,VILA MATILDE,"RUA DOM JOAO MARIA OGNO, 60, São Paulo",-23.53916,EE DOM BERNARDO RODRIGUES NOGUEIRA,-46.519165,Da 73ª à 88ª.,VILA MATILDE,347
10292,VILA MATILDE,"RUA DONA ESCOLÁSTICA MELCHERT DA FONSECA, 108, São Paulo",-23.533678,ESCOLA SAO JOSÉ DE VILA MATILDE,-46.525044,Da 29ª à 56ª.,VILA MATILDE,347
3833,CIDADE PATRIARCA,"RUA DOUTOR FREDERICO BROTERO, 134, São Paulo",-23.536859,EMEF. JOSÉ BONIFÁCIO,-46.504269,Da 132ª à 134ª; 290ª; 338ª; 376ª; 392ª; 397ª; 422ª; 435ª;,VILA MATILDE,347
4167,VILA ARICANDUVA,"RUA DOUTOR LUIS CARLOS, 1400, São Paulo",-23.533541,EE PROFESSORA MARISA DE MELLO,-46.536499,Da 8ª à 13ª; 243ª; 300ª; 337ª; 363ª; 399ª; 426ª;,VILA MATILDE,347
4261,VILA MATILDE,"RUA EDGAR GARCIA VIEIRA, 140, São Paulo",-23.535049,EMEF. PRESIDENTE JOÃO PINHEIRO,-46.531921,Da 20ª à 28ª; 226ª; 237ª;,VILA MATILDE,347
1584,VILA DALILA,"RUA FELIPE SALOMÃO , 136, São Paulo",-23.545034,EMEI. MARIA LACERDA DE MOURA,-46.518795,Da 166ª à 168ª; 346ª;,VILA MATILDE,347
8056,VILA SANTA TERESA,"RUA FERNANDES PEREIRA, 690, São Paulo",-23.5401,EE PROFESSORA MARIA AUGUSTA DE ÁVILA,-46.490566,Da 89ª à 110ª.,VILA MATILDE,347
1575,JARDIM BRASILIA,"RUA FIGUEIRA DA BARBÁRIA, 481, São Paulo",-23.559231,EMEI. MINISTRO PEDRO CHAVES,-46.493992,305ª; 330ª; 344ª; 367ª;,VILA MATILDE,347
5883,JARDIM IPANEMA(ZONA LESTE),"RUA FRANCESCO MELZI, 305, São Paulo",-23.562889,EE PROF. SÉRGIO DA SILVA NOBREZA,-46.498402,263ª; 269ª; 271ª; 274ª; Da 279ª à 280ª; 286ª; 295ª; Da 311ª à 312ª; 345ª; 388ª; 400ª; 427ª; 449ª; 454ª; 457ª;,VILA MATILDE,347
2464,VILA ARICANDUVA,"RUA FREI MONTE ALVERNE, 445, São Paulo",-23.536661,COLÉGIO VICENTE PALOTTI,-46.537281,Da 14ª à 19ª; 446ª;,VILA MATILDE,347
5126,JARDIM ELIANE,"RUA GALEANDRA, S/N, São Paulo",-23.5511,EMEF.  BRIGADEIRO CORREIA DE MELLO,-46.50383,267ª; 270ª; 272ª; 278ª; 284ª; 288ª; 307ª; 316ª; 328ª; 336ª; 358ª; 374ª; 431ª;,VILA MATILDE,347
3481,JARDIM SANTA MARIA,"RUA GARUVA, 55, São Paulo",-23.554419,EE DOM CAMILO MARIA CAVALHEIRO,-46.508377,283ª; 292ª; 304ª; 318ª; 331ª; 343ª; 351ª; 371ª; 447ª;,VILA MATILDE,347
1588,JARDIM FERNANDES,"RUA HELENA DOS SANTOS, S/N, São Paulo",-23.555491,EE PROF. ANTENOR SANTOS OLIVEIRA,-46.497921,384ª; 387ª; 401ª; 432ª; 442ª; 461ª;,VILA MATILDE,347
6609,VILA DALILA,"PRAÇA BAUXITA, 99, São Paulo",-23.539753,EMEF. DEZENOVE DE NOVEMBRO,-46.524353,Da 153ª à 165ª; 356ª;,VILA MATILDE,347
4194,VILA NHOCUNE,"RUA ISAURA VERGUEIRO NAUFEL, 238, São Paulo",-23.547272,EMEF.  ABRÃO DE MORAES,-46.499065,215ª; 220ª; 225ª; 234ª; 239ª; 250ª; 268ª; 277ª; 297ª; 323ª; 430ª;,VILA MATILDE,347
1349,JARDIM IPANEMA(ZONA LESTE),"RUA ITAICICA, 20, São Paulo",-23.560963,EE PROFESSORA MARIA JOSÉ BARONE FERNANDES,-46.504078,383ª; 404ª; 441ª; 451ª;,VILA MATILDE,347
3946,VILA MATILDE,"RUA JOSÉ MASCARENHAS, 456, São Paulo",-23.539026,EE PROFESSORA MARIA DE LOURDES NOGUEIRA ALBERGARIA,-46.532909,Da 67ª à 72ª; 294ª; 314ª; 333ª; 352ª; 411ª;,VILA MATILDE,347
1341,VILA EUTHALIA,"RUA MOACIR ALVARO, 139, São Paulo",-23.543871,ESCOLA SAINT GERMAIN,-46.524319,385ª; 407ª; 420ª; 438ª; 443ª;,VILA MATILDE,347
3364,JARDIM MARINGA,"RUA MUANA, 31, São Paulo",-23.55333,EE PROF. AFONSO PENNA JÚNIOR,-46.514938,Da 255ª à 259ª; 261ª; 265ª; 276ª; 364ª; 463ª;,VILA MATILDE,347
4286,CIDADE PATRIARCA,"RUA PALMEIRINA, 189, São Paulo",-23.541349,EE PROF. JAMIL PEDRO SAWAYA,-46.501732,Da 121ª à 131ª.,VILA MATILDE,347
3008,VILA NOVA SAVOIA,"RUA PARANHOS, 264, São Paulo",-23.54348,EE DR. JOSÉ PEREIRA DE QUEIROZ,-46.515175,Da 207ª à 213ª; 219ª;,VILA MATILDE,347
1140,VILA GUILHERMINA,"RUA SANTO ALEXANDRE, 21, São Paulo",-23.53079,CENTRO EDUCATIVO E DE ASSISTÊNCIA SOCIAL LA SALLE,-46.515549,406ª; 421ª; 436ª; 448ª;,VILA MATILDE,347
3738,VILA GUILHERMINA,"RUA SAO BENTO DO SAPUCAÍ, 677, São Paulo",-23.53264,EE PROFESSORA ADELAIDE FERRAZ DE OLIVEIRA,-46.514389,195ª; 264ª; 273ª; 287ª; 309ª; 327ª; 340ª; 355ª; 366ª; 403ª;,VILA MATILDE,347
3133,JARDIM SAO JOSE,"RUA SUSANA DACRE, 8, São Paulo",-23.547752,EE AUGUSTO BAILLOT,-46.492321,282ª; 299ª; 306ª; 325ª; 347ª; 365ª; 390ª; 414ª; 445ª; 464ª;,VILA MATILDE,347
5686,VILA MATILDE,"RUA TEODORO MASCARENHAS, 133, São Paulo",-23.54207,EE INFANTE DOM HENRIQUE,-46.531117,Da 57ª à 66ª; 218ª; 229ª; 238ª; 313ª; 412ª;,VILA MATILDE,347
1545,VILA EUTHALIA,"RUA VISCONDE DO URUGUAI, 380, São Paulo",-23.54307,CEI ANNA FLORÊNCIO ROMÃO,-46.52319,298ª; 310ª; 317ª; 329ª;,VILA MATILDE,347
2459,VILA FORMOSA,"AVENIDA JOÃO 23, 1071, São Paulo",-23.570763,EXTERNATO NOSSA SENHORA DO SAGRADO CORAÇÃO UNIDADE 2,-46.530922,212ª; 224ª; 236ª; 239ª; 246ª; 249ª; 280ª;,VILA FORMOSA,348
5078,JARDIM VILA FORMOSA,"AVENIDA MONSENHOR ANTÔNIO DE CASTRO, 222, São Paulo",-23.570921,EMEF. DR. JOÃO NAOKI SUMITA,-46.527611,Da 71ª à 79ª; 176ª; 189ª; 234ª; 283ª;,VILA FORMOSA,348
6359,VILA FORMOSA,"PRAÇA NOSSA SENHORA DAS VITÓRIAS, 92, São Paulo",-23.564501,COLÉGIO ALVORADA,-46.549095,Da 64ª à 70ª; Da 157ª à 161ª; 213ª; 216ª; 237ª; 272ª; 287ª;,VILA FORMOSA,348
5647,VILA FORMOSA,"RUA ACURUÍ, 700, São Paulo",-23.56134,EMEF. PRESIDENTE KENNEDY,-46.552898,Da 1ª à 11ª; 214ª; 229ª; 245ª; 284ª;,VILA FORMOSA,348
