aptos_por_local,bairro,endereco,lat,local_de_votacao,long,secoes_eleitorais,zona_eleitoral_nome,zona_eleitoral_nro
2080,JARDIM DA CONQUISTA,"TRAVESSA SINHÁ MOÇA, 52, São Paulo",-23.60828,EE. CONJUNTO HABITACIONAL CARRÃOZINHO 3,-46.454922,470ª; 475ª; 625ª; 642ª; 660ª; 669ª; 678ª; 719ª; 728ª; 731ª;,SÃO MATEUS,375
6866,JARDIM DA CONQUISTA,"TRAVESSA TERRA TOMBADA, S/N, São Paulo",-23.61157,E.E. VILA BELA,-46.450359,495ª; 499ª; 505ª; 511ª; 515ª; 520ª; 525ª; 552ª; 557ª; 569ª; 576ª; 583ª; 589ª; 595ª; 601ª; 607ª; 611ª; 616ª; 624ª; 633ª;,SÃO MATEUS,375
15596,JARDIM GUARANI,"AVENIDA DEPUTADO CANTIDIO SAMPAIO, 1701, São Paulo",-23.464043,EE. PROFESSOR WALFREDO ARANTES CALDAS,-46.680618,Da 106ª à 126ª; 562ª;,BRASILÂNDIA,376
15596,JARDIM GUARANI,"AVENIDA DEPUTADO CANTÍDIO SAMPAIO, 1701, São Paulo",-23.464043,EE. VILA PENTEADO II,-46.680618,489ª; 503ª; 512ª; 523ª; 545ª; 580ª; 617ª; 636ª;,BRASILÂNDIA,376
15596,JARDIM GUARANI,"AVENIDA DEPUTADO CANTÍDIO SAMPAIO, 1701, São Paulo",-23.464043,EE. PROFESSORA LUIZA SALETTE JUNCÁ DE ALMEIDA,-46.680618,336ª; 347ª; 354ª; 365ª; 372ª; 382ª; 388ª; 397ª; 403ª; 411ª; 419ª; 432ª; 446ª; 454ª; 474ª; 544ª;,BRASILÂNDIA,376
2306,JARDIM ISMENIA,"AVENIDA DEPUTADO CANTÍDIO SAMPAIO, 4678, São Paulo",-23.44824,EE. PROFESSORA MARIA HELENA GONÇALVES DE ARRUDA,-46.702492,445ª; 479ª; 506ª; 539ª; 558ª; 563ª; 605ª; 628ª;,BRASILÂNDIA,376
5870,JARDIM DOS FRANCOS,"AVENIDA GENERAL PENHA BRASIL, 3001, São Paulo",-23.450682,EE. PROFESSOR FLAMÍNIO FAVERO,-46.67857,250ª; Da 252ª à 254ª; 260ª; 263ª; 266ª; 271ª; Da 276ª à 277ª; 282ª; 289ª; 291ª; 297ª; 299ª;,BRASILÂNDIA,376
3778,VILA PENTEADO,"AVENIDA GUILHERME DE ALMEIDA, 110, São Paulo",-23.467136,EMEF. THÉO DUTRA,-46.680893,Da 256ª à 258ª; 261ª; 264ª; Da 267ª à 268ª; 272ª; 278ª; 551ª; 609ª; 643ª;,BRASILÂNDIA,376
2311,JARDIM DOS FRANCOS,"AVENIDA INAJAR DE SOUZA, 6975, São Paulo",-23.465557,EMEF. PROFESSOR PRIMO PASCOLI MELARE,-46.671291,338ª; 349ª; 389ª; 444ª; 493ª; 527ª; 594ª; 640ª;,BRASILÂNDIA,376
3102,PARQUE SÃO LUIS,"AVENIDA JOAO PAULO I, 1347, São Paulo",-23.486815,EMEI FELIPE MESTRE JOU,-46.687912,361ª; 370ª; 376ª; 385ª; 394ª; 402ª; 415ª; 435ª;,BRASILÂNDIA,376
4122,VILA PENTEADO,"AVENIDA JOSE DA NATIVIDADE SALDANHA, S/N, São Paulo",-23.473989,EE. PROFESSORA ELIZABETH APARECIDA SIMÕES MESQUITA,-46.684311,Da 81ª à 90ª; 556ª;,BRASILÂNDIA,376
8730,JARDIM MARISTELA,"ESTRADA DO SABÃO, 1497, São Paulo",-23.469423,EE. JOÃO SOLIMEO,-46.697666,Da 1ª à 18ª; 269ª; 273ª; 275ª; 281ª; 561ª;,BRASILÂNDIA,376
7099,JARDIM MARISTELA,"ESTRADA DO SABÃO, 1547, São Paulo",-23.468893,EE. PROFESSOR GALDINO LOPES CHAGAS,-46.697697,Da 19ª à 36ª.,BRASILÂNDIA,376
4973,JARDIM ELISA MARIA,"RUA AGENOR ALVES MEIRA, 285, São Paulo",-23.459202,EMEF. CASTRO ALVES,-46.677998,340ª; 346ª; 360ª; 379ª; 392ª; 405ª; 425ª; 449ª; 470ª; 490ª; 513ª; 570ª; 592ª;,BRASILÂNDIA,376
6119,PARQUE SÃO LUIS,"RUA ALBERTO ANDALO, 36, São Paulo",-23.482912,EMEF. PROFESSORA JOANINHA GRASSI FAGUNDES,-46.687698,Da 154ª à 167ª; 546ª; 574ª;,BRASILÂNDIA,376
1647,JARDIM MONTE ALEGRE,"RUA ANTONIO GENELLE, 151, São Paulo",-23.470535,EMEI MANUEL BANDEIRA,-46.718849,430ª; 468ª; 491ª; 516ª; 530ª;,BRASILÂNDIA,376
1814,JARDIM PAULISTANO (ZONA NORTE),"RUA APARECIDA DO TABOADO, S/N, São Paulo",-23.461069,CEU PAULISTANO - EMEF JARDIM PAULISTANO,-46.711639,374ª; 455ª; 540ª; 572ª; 606ª; 614ª; 621ª; 629ª; 634ª; 638ª;,BRASILÂNDIA,376
6523,VILA PENTEADO,"RUA CAIAPÉ, S/N, São Paulo",-23.471251,EE. CHIQUINHA RODRIGUES,-46.68354,Da 91ª à 105ª; 251ª; 529ª;,BRASILÂNDIA,376
4477,PARQUE SÃO LUIS,"RUA CAPITÃO JOSE AMARAL, 44, São Paulo",-23.480036,EE. CACILDA BECKER,-46.6917,Da 168ª à 177ª; 548ª; 607ª; 630ª;,BRASILÂNDIA,376
5410,VILA CRUZ DAS ALMAS,"RUA CONCEIÇÃO DE JACAREÍ, 8, São Paulo",-23.480385,EE. DOUTOR AUGUSTO DE MACEDO COSTA,-46.698666,Da 142ª à 153ª; 333ª; 541ª; 602ª;,BRASILÂNDIA,376
4399,JARDIM ONDINA,"RUA CRISTOVÃO SANTIAGO, 50, São Paulo",-23.461424,EE. JOÃO BOEMER JARDIM,-46.673843,310ª; 312ª; 316ª; 320ª; 323ª; 325ª; 329ª; 343ª; 466ª; 521ª; 532ª; 567ª; 627ª;,BRASILÂNDIA,376
6851,JARDIM DAMASCENO,"RUA DOMINGOS AREVALO, 862, São Paulo",-23.446125,EE. DOUTOR GENÉSIO DE ALMEIDA MOURA,-46.694996,286ª; 298ª; 305ª; 311ª; 321ª; 328ª; 350ª; 369ª; 386ª; 399ª; 410ª; 426ª; 459ª; 486ª; 518ª; 538ª; 564ª; 596ª; 619ª; 641ª;,BRASILÂNDIA,376
3166,JARDIM MARISTELA,"RUA DOUTOR PINHEIRO DE FARIA, 40, São Paulo",-23.474653,EE. PROFESSOR OSMAR BASTOS CONCEIÇÃO,-46.70044,284ª; 302ª; 327ª; 353ª; 371ª; 387ª; 401ª; 416ª;,BRASILÂNDIA,376
3456,VILA PENTEADO,"RUA EMÍLIO KEMP, 126, São Paulo",-23.47394,EE. PROFESSORA OLINDA LEITE SINISGALI,-46.677368,420ª; 433ª; 450ª; 475ª; 499ª; 526ª; 555ª; 588ª; 599ª; 615ª; 642ª;,BRASILÂNDIA,376
261,JARDIM CARUMBÉ,"RUA EUVALDO AUGUSTO FREIRE, 02, São Paulo",-23.45414,EMEI CORONEL JOSÉ CANAVÓ FILHO,-46.699619,585ª; 631ª;,BRASILÂNDIA,376
6263,PARQUE MANDI,"RUA GENERAL ULHOA CINTRA, 37, São Paulo",-23.48321,EE. PROFESSOR PLÍNIO DAMASCO PENNA,-46.6838,Da 217ª à 227ª; 255ª; 259ª; 274ª; 318ª; 332ª;,BRASILÂNDIA,376
2269,JARDIM VISTA ALEGRE,"RUA IBIRAIARAS, 19, São Paulo",-23.450333,EMEI BILAC PINTO,-46.68475,460ª; 473ª; 488ª; 504ª; 517ª; 536ª; 600ª;,BRASILÂNDIA,376
4266,JARDIM VISTA ALEGRE,"RUA IBIRAIARAS, 400, São Paulo",-23.450655,EMEF. JOÃO AMÓS COMENIUS,-46.687882,339ª; 355ª; 368ª; 381ª; 396ª; 409ª; 431ª; 448ª; 537ª; 575ª; 591ª; 612ª; 623ª;,BRASILÂNDIA,376
7692,VILA NINA,"RUA JERÔNIMO SOUTO MAIOR, 120, São Paulo",-23.47632,EE. PROFESSOR EDGARD PIMENTEL REZENDE,-46.693119,Da 53ª à 71ª; 265ª;,BRASILÂNDIA,376
1911,VILA NINA,"RUA JERÔNIMO SOUTO MAIOR, 300, São Paulo",-23.472923,EMEI PROFESSOR TITO LIVIO FERREIRA,-46.693008,414ª; 434ª; 447ª; 462ª; 478ª; 557ª; 578ª;,BRASILÂNDIA,376
695,JARDIM MARACANÃ,"RUA JITAÚNA, 30, São Paulo",-23.4774,C.I.E.J.A. PROFESSORA ROSE MARY FRASSON,-46.6824,458ª; 525ª; 603ª;,BRASILÂNDIA,376
6723,JARDIM DO TIRO,"RUA JOAQUIM DE ALMEIDA MORAIS, S/N, São Paulo",-23.473841,EE. PROFESSOR JAIR TOLEDO XAVIER,-46.688122,279ª; 288ª; 295ª; 300ª; 307ª; 315ª; 324ª; 331ª; 345ª; 351ª; 356ª; 423ª; 441ª; 463ª; 480ª; 500ª; 547ª;,BRASILÂNDIA,376
5589,JARDIM PAULISTANO (ZONA NORTE),"RUA JOAQUIM DE SOUSA BRITO, 122, São Paulo",-23.459728,EE. PROFESSOR CRISPIM DE OLIVEIRA,-46.660465,341ª; 358ª; 380ª; 398ª; 413ª; 438ª; 453ª; 472ª; 487ª; 505ª; 519ª; 542ª; 571ª; 590ª; 595ª;,BRASILÂNDIA,376
1333,JARDIM PARANÁ,"RUA DANIEL CERRI, 1549, São Paulo",-23.471434,CEU DA PAZ - EMEF SENADOR TEOTONIO VILELA,-46.669235,457ª; 495ª; 535ª; 579ª; 611ª; 637ª;,BRASILÂNDIA,376
4972,VILA RICA,"RUA JOAQUINA MARIA DOS SANTOS, 177, São Paulo",-23.470896,EMEF. DESEMBARGADOR SEBASTIÃO NOGUEIRA DE LIMA,-46.673637,285ª; 287ª; 294ª; Da 303ª à 304ª; 314ª; 330ª; 373ª; 400ª; 422ª; 476ª; 509ª; 565ª;,BRASILÂNDIA,376
8053,JARDIM GUARANI,"RUA JOSÉ DA COSTA PEREIRA, 70, São Paulo",-23.46018,EE. DOUTOR UBALDO COSTA LEITE,-46.68708,Da 228ª à 248ª.,BRASILÂNDIA,376
7847,BRASILANDIA,"RUA JOSÉ SIQUEIRA BRITO, S/N, São Paulo",-23.468611,EMEF. GERALDO SESSO JÚNIOR,-46.690479,Da 197ª à 216ª.,BRASILÂNDIA,376
2089,VILA PENTEADO,"RUA LUIZ JOSÉ JUNQUEIRA FREIRE, 125, São Paulo",-23.473539,CEI VILA PENTEADO,-46.679913,440ª; 452ª; 469ª; 481ª; 492ª; 550ª;,BRASILÂNDIA,376
6290,SÍTIO MORRO GRANDE,"RUA MANOEL DE SOUZA AZEVEDO, 364, São Paulo",-23.471705,EE. CLODOMIRO CARNEIRO,-46.703026,Da 127ª à 141ª; 334ª; 553ª;,BRASILÂNDIA,376
4771,JARDIM ALMANARA,"RUA MANUEL INÁCIO ALVARENGA, 50, São Paulo",-23.476608,EMEF. PROFESSOR ANTONIO PRUDENTE,-46.676315,262ª; 270ª; 280ª; 293ª; 308ª; 319ª; 335ª; 357ª; 367ª; 378ª; 390ª; 406ª;,BRASILÂNDIA,376
7337,VILA TERESINHA,"RUA MARCELINO JOSÉ DE FREITAS, 619, São Paulo",-23.459009,EMEF. PROFESSOR ANDRÉ RODRIGUES DE ALCKIMIN,-46.694382,Da 178ª à 196ª.,BRASILÂNDIA,376
3691,JARDIM ONDINA,"RUA MONTES PIRINEUS, 600, São Paulo",-23.463869,EE. HÉLIOS HEBER LINO,-46.674141,359ª; 383ª; 408ª; 439ª; 471ª; 497ª; 522ª; 554ª; 584ª; 593ª; 610ª; 624ª;,BRASILÂNDIA,376
4001,BRASILANDIA,"RUA NAIR RAMOS SCHURING, 2515, São Paulo",-23.469339,EMEF. EMBAIXADOR RAUL FERNANDES,-46.690929,352ª; 366ª; 375ª; 384ª; 393ª; 404ª; 412ª; 418ª; 496ª; 502ª; 520ª; 533ª;,BRASILÂNDIA,376
937,PARQUE BELÉM,"RUA OTELO ZELONI, 60, São Paulo",-23.465797,EMEI ANITA GARIBALDI,-46.681713,456ª; 507ª; 552ª; 598ª;,BRASILÂNDIA,376
4187,BRASILANDIA,"RUA PAULO GARCIA AQUILINE, 406, São Paulo",-23.46978,EE. MARTIN EGÍDIO DAMY,-46.68647,Da 72ª à 80ª; 249ª; 511ª;,BRASILÂNDIA,376
7506,VILA ISABEL,"RUA PEDRO ANTONIO CONCEIÇÃO, 255, São Paulo",-23.461069,EE. DEPUTADO LUIZ SÉRGIO CLAUDINO DOS SANTOS,-46.700729,283ª; 290ª; 292ª; 296ª; 301ª; 306ª; 309ª; 313ª; 317ª; 322ª; 326ª; 342ª; Da 362ª à 363ª; 395ª; 484ª; 510ª; 560ª; 566ª; 569ª; 577ª;,BRASILÂNDIA,376
359,VILA FRANCOS,"RUA POMPEU PEQUENO SOUZA BRASIL, 89, São Paulo",-23.467331,EE. PROFESSOR JÚLIO DE FARIA E SOUZA,-46.67474,586ª; 622ª;,BRASILÂNDIA,376
3556,CONJUNTO PROMORAR ESTRADA DA PARADA,"RUA ROMULO NALDI, 147, São Paulo",-23.455681,EMEF. PROFESSORA CECÍLIA MORAES DE VASCONCELOS,-46.684818,424ª; 461ª; 482ª; 508ª; 528ª; 534ª; 583ª; 589ª; 597ª; 608ª; 618ª; 620ª; 635ª; 639ª;,BRASILÂNDIA,376
555,JARDIM CARUMBÉ,"RUA ROSALVO JOSÉ DA SILVA, S/N, São Paulo",-23.456341,EE. JARDIM CARUMBÉ,-46.703041,604ª; 616ª; 625ª; 632ª;,BRASILÂNDIA,376
1468,JARDIM GUARANI,"RUA SANTANA DO ARAÇUAÍ, 190, São Paulo",-23.462311,EMEF. PROFESSOR JOSÉ ALFREDO APOLINÁRIO,-46.69035,494ª; 514ª; 559ª; 576ª; 613ª; 633ª;,BRASILÂNDIA,376
2359,VILA BANCARIA MUNHOZ,"RUA VICENTE JORGE, 100, São Paulo",-23.482376,EMEF. PEDRO AMÉRICO,-46.678223,Da 436ª à 437ª; 467ª; 501ª; 549ª; 573ª; 581ª; 626ª;,BRASILÂNDIA,376
816,SÍTIO MORRO GRANDE,"RUA XAVIER DA SILVA FERRÃO, 217, São Paulo",-23.470207,EMEF. PROFESSORA CAIRA ALAYDE ALVARENGA MEDEA,-46.701832,524ª; 531ª; 582ª; 601ª;,BRASILÂNDIA,376
7009,JARDIM FLORESTA,"AV CARLOS OBERHUBER, 90, São Paulo",-23.740681,EE. PROF. ALBERTO SALOTTI,-46.706291,Da 223ª à 239ª; 507ª;,PARELHEIROS,381
4027,JARDIM GUANABARA,"AV. MARGUERITTE LONG, 41, São Paulo",-23.763901,EMEF. PROF. FLORESTAN FERNANDES,-46.71294,369ª; 381ª; 386ª; 396ª; 399ª; 406ª; 412ª; 420ª; 427ª; 434ª; 443ª;,PARELHEIROS,381
7110,JARDIM NOVO HORIZONTE,"AV. PAULO GUILGUER REIMBERG, 2448, São Paulo",-23.776051,EE. PRESIDENTE TANCREDO DE ALMEIDA NEVES,-46.696919,Da 12ª à 26ª; 206ª; Da 261ª à 262ª; 279ª;,PARELHEIROS,381
1271,CHACARA SANTO AMARO,"AV. PAULO GUILGUER REIMBERG, 9865, São Paulo",-23.810123,EE. HERMINIO SACCHETTA,-46.676659,289ª; 348ª; 421ª; 512ª;,PARELHEIROS,381
4203,PARELHEIROS,"AV. SADAMU INOUE, 210, São Paulo",-23.820911,EE. DONA PRISCILIANA DUARTE DE ALMEIDA,-46.736103,114ª; Da 251ª à 260ª; 405ª;,PARELHEIROS,381
5138,JARDIM MYRNA,"ESTRADA DA COCAIA, 2882, São Paulo",-23.769762,EE. LEVI CARNEIRO,-46.699345,Da 115ª à 128ª.,PARELHEIROS,381
5017,JARDIM NORONHA,"ESTRADA DO BARRO BRANCO, S/N, São Paulo",-23.774599,CEU. EMEF. TRÊS LAGOS,-46.68132,457ª; 462ª; 467ª; 472ª; 480ª; 485ª; 491ª; 495ª; 499ª; 503ª; 510ª; 564ª;,PARELHEIROS,381
5017,JARDIM NORONHA,"ESTRADA DO BARRO BRANCO, S/N, São Paulo",-23.774599,CEU. EMEI. TRÊS LAGOS,-46.68132,513ª; 517ª; 526ª; 530ª; 535ª; 537ª; 541ª; 547ª; 550ª; 553ª;,PARELHEIROS,381
2166,EMBURA,"ESTRADA ENGENHEIRO MARSILAC, 8029, KILOMETRO 45,8, São Paulo",-23.90661,EE. PROF. HILTON REIS DOS SANTOS,-46.704193,291ª; Da 294ª à 295ª; 333ª; 378ª; 410ª; 497ª; 558ª;,PARELHEIROS,381
6163,JARDIM MYRNA,"ESTRADA MUNICIPAL, S/N, São Paulo",-23.861601,EE. ROBERTO MANGE,-46.75906,285ª; 298ª; 305ª; 309ª; 314ª; 319ª; 326ª; 329ª; 331ª; 336ª; 341ª; 347ª; 349ª; 352ª; Da 355ª à 356ª; 364ª;,PARELHEIROS,381
6552,JARDIM IPORÃ,"RUA AMARO ALVES DO ROSÁRIO, 1500, São Paulo",-23.81262,EE. REVERENDO ERODICE PONTES DE QUEIRÓZ,-46.720631,Da 195ª à 199ª; 267ª; 277ª; 297ª; 308ª; 325ª; 338ª; 353ª; 361ª; 366ª; 382ª; 389ª; 403ª; 417ª;,PARELHEIROS,381
3836,JARDIM FLORESTA,"RUA ANTONIO BORGES DA FONSECA, 15, São Paulo",-23.74078,EM. OLEGARIO MARIANO,-46.709435,Da 1ª à 11ª.,PARELHEIROS,381
320,JARDIM ALADIM,"RUA ANTÔNIO MARCONDES BOETA, 30, São Paulo",-23.808571,EMEI. PROF. JOSÉ LA TORRE,-46.735771,477ª; 533ª; 563ª;,PARELHEIROS,381
2442,VILA ROSCHEL,"RUA BENJAMIM DIEMAR, S/N, São Paulo",-23.839581,EE. PROF. BENEDITO FERREIRA DE ALBUQUERQUE,-46.735939,Da 157ª à 163ª.,PARELHEIROS,381
4900,JARDIM KIOTO,"RUA BREST, 2, São Paulo",-23.73225,EE. HOMERO VAZ DO AMARAL,-46.717918,Da 147ª à 156ª; 207ª; 263ª; 318ª;,PARELHEIROS,381
1309,JARDIM CAMPINAS,"RUA CONSTELAÇÃO DO ÍNDIO, 41, São Paulo",-23.772453,EMEF. CONSTELAÇÃO DO ÍNDIO,-46.708469,488ª; 498ª; 511ª; 520ª; 543ª; 561ª;,PARELHEIROS,381
4073,JARDIM ALPINO,"RUA DOMINGOS FAUSTINO SARMIENTO, 422, São Paulo",-23.74568,EE. JOSÉ DUARTE JUNIOR,-46.71159,286ª; 311ª; 327ª; 345ª; 357ª; 380ª; 398ª; 409ª; 428ª; 439ª; 451ª;,PARELHEIROS,381
6851,JARDIM SABIÁ II,"RUA FALCÃO PEREGRINO, 22, São Paulo",-23.782921,EE. JARDIM SABIÁ 2,-46.693409,505ª; 515ª; 522ª; 531ª; 539ª; 548ª; 552ª; 560ª;,PARELHEIROS,381
6851,JARDIM SABIA II,"RUA FALCÃO PEREGRINO, 22, São Paulo",-23.782921,EE. ENGENHEIRO ARGEO PINTO DIAS,-46.693409,287ª; 304ª; 324ª; 343ª; 359ª; 379ª; 390ª; 401ª; 416ª; 429ª; 441ª; 455ª; 465ª; 476ª; 493ª;,PARELHEIROS,381
3049,JARDIM SÃO RAFAEL,"RUA FREI AMADOR ARRAIS, 100, São Paulo",-23.76083,EE. PROFA. MARIA AMÉLIA BRAZ,-46.717201,Da 144ª à 146ª; 185ª; 264ª; 276ª; 301ª; 312ª; 368ª;,PARELHEIROS,381
2635,JARDIM NOVO PARELHEIROS,"RUA GENTIL SCHUNCK ROSCHEL, 79, São Paulo",-23.828751,EMEI. JOSÉ ROSCHEL CHRISTI,-46.727249,184ª; Da 186ª à 192ª;,PARELHEIROS,381
2055,ENGENHEIRO MARSILAC,"RUA DOIS, 101, São Paulo",-23.780946,EE. LEONOR FERNANDES COSTA ZACARIAS,-46.708374,290ª; 296ª; 335ª; 342ª; 392ª; 448ª; 538ª;,PARELHEIROS,381
2089,BARRAGEM,"RUA DOIS, 02, São Paulo",-23.754553,EE. PROF. JOAQUIM ALVARES CRUZ,-46.707687,316ª; 337ª; 365ª; 413ª; 432ª; 487ª; 529ª; 554ª;,PARELHEIROS,381
948,ENGENHEIRO MARSILAC,"RUA FILOMENA BELMONTE, 75, São Paulo",-23.733812,EE. REGINA MIRANDA BRANT DE CARVALHO,-46.711807,292ª; 299ª; 449ª;,PARELHEIROS,381
6432,COLONIA (ZONA SUL),"RUA BEIJA-FLOR, 01, São Paulo",-23.784716,EMEF. VARGEM GRANDE,-46.711807,Da 106ª à 112ª; 271ª; 293ª; 310ª; 332ª; 350ª; 360ª; 374ª; 384ª; 394ª; 407ª; 422ª;,PARELHEIROS,381
3553,JARDIM MYRNA,"ESTRADA MUNICIPAL, 340, São Paulo",-23.755182,EE. JARDIM MYRNA II,-46.715927,Da 200ª à 205ª; Da 268ª à 270ª; 278ª;,PARELHEIROS,381
4724,JARDIM DOS ALAMOS,"RUA DA BICA, S/N, São Paulo",-23.789115,EE. LEDA GUIMARÃES NATAL,-46.720734,Da 281ª à 284ª; 306ª; 313ª; 320ª; 328ª; 334ª; 346ª; 354ª; 362ª; 372ª; 391ª;,PARELHEIROS,381
5232,JARDIM ROSALINA,"RUA GEORGINA BOCHIGLIERI, 317, São Paulo",-23.73793,EM. PROF. MILTON ABREU FERREIRA DE ALBUQUERQUE,-46.707771,Da 62ª à 76ª.,PARELHEIROS,381
2139,GRANJA NOSSA SENHORA APARECIDA,"RUA HANS CHRISTIAN HANDERSEN, 67, São Paulo",-23.759205,EMEF. GRANJA NOSSA SENHORA APARECIDA,-46.713333,459ª; 468ª; 482ª; 492ª; 502ª; 516ª; 542ª;,PARELHEIROS,381
6775,JARDIM NOVO HORIZONTE,"RUA HENRIQUE MUZZIO, 233, São Paulo",-23.786249,EE. PROFA. JUVENTINA MARCONDES DOMINGUES DE CASTRO,-46.684609,303ª; 317ª; 330ª; 344ª; 351ª; 363ª; 373ª; 383ª; 397ª; 404ª; 414ª; 424ª; 440ª; 452ª; 466ª; 475ª; 490ª;,PARELHEIROS,381
3611,JARDIM SANTA FÉ (ZONA SUL),"RUA HIERÁPOLIS, 248, São Paulo",-23.765699,EE. JARDIM SANTA FÉ II,-46.70385,418ª; 430ª; 435ª; 442ª; 447ª; 453ª; 458ª; 463ª; 471ª; 474ª;,PARELHEIROS,381
4382,JARDIM DOS ALAMOS,"RUA JOSÉ MENDES NETTO, S/N, São Paulo",-23.811449,EE. DOUTOR MARIO LOPES LEÃO,-46.738049,Da 52ª à 61ª; 339ª; 367ª;,PARELHEIROS,381
9669,JARDIM NOVO PARELHEIROS,"RUA JOSÉ PEDRO DE BORBA, 20, São Paulo",-23.827471,CEU. EMEI. PARELHEIROS,-46.72633,489ª; 494ª; 496ª; 501ª; 508ª; 514ª; 519ª; 528ª; 534ª;,PARELHEIROS,381
9669,JARDIM NOVO PARELHEIROS,"RUA JOSÉ PEDRO DE BORBA, 20, São Paulo",-23.827471,CEU. EMEF. MANOEL VIEIRA DE QUEIRÓZ FILHO,-46.72633,Da 193ª à 194ª; Da 272ª à 275ª; 419ª; 431ª; 438ª; 445ª; 450ª; 456ª; 460ª; 464ª; 470ª; 473ª; 478ª; 484ª;,PARELHEIROS,381
6416,RECANTO CAMPO BELO,"RUA JOSÉ ROSCHEL RODRIGUES, 146, São Paulo",-23.793055,EE. PROF. MARIO ARMINANTE,-46.730579,Da 164ª à 178ª; 500ª; 523ª; 540ª; 549ª; 562ª;,PARELHEIROS,381
4018,JARDIM VISTA ALEGRE,"RUA LECONTE DE LISLE, 300, São Paulo",-23.738054,EE. PROFA. VERA ATHAYDE PEREIRA,-46.711735,Da 240ª à 250ª.,PARELHEIROS,381
3596,JARDIM ALADIM,"RUA LUIZ PINELLI, 148, São Paulo",-23.808189,EE. PROF. CANDIDO DE OLIVEIRA,-46.735588,Da 96ª à 105ª.,PARELHEIROS,381
2385,RECANTO CAMPO BELO,"RUA MARCELO BERNARDINI, S/N, São Paulo",-23.79677,EMEI. RECANTO CAMPO BELO,-46.735779,370ª; 387ª; 402ª; Da 425ª à 426ª; 444ª; 479ª; 546ª;,PARELHEIROS,381
4181,JARDIM NOVO PARELHEIROS,"RUA MARIA ROSCHEL SCHUNCK, 915 A, São Paulo",-23.830429,EE. SENADOR ALEXANDRE MARCONDES FILHO,-46.724781,Da 40ª à 51ª.,PARELHEIROS,381
4493,COLONIA (ZONA SUL),"RUA PAULINO GOTTSFRITZ, 50, São Paulo",-23.846975,EE. LUCAS ROSCHEL RASQUINHO,-46.697662,288ª; 302ª; 315ª; 340ª; 358ª; 388ª; 411ª; 436ª; 454ª; 469ª; 486ª; 504ª; 545ª;,PARELHEIROS,381
807,JARDIM FLORESTA,"RUA VENÂNCIO POLETTI, 181, São Paulo",-23.74181,EMEI. PROFA. ODILÉA BOTTA DE MATTOS,-46.711159,461ª; 483ª; 525ª;,PARELHEIROS,381
3363,JARDIM BRASILIA,"AVENIDA DEPUTADO CANTIDIO SAMPAIO, 5647, São Paulo",-23.441879,EE. PROFª  EULICE SILVIO MENDONÇA DA SILVA,-46.707329,Da 105ª à 107ª; 278ª; 322ª; 355ª; 366ª; 380ª; 415ª; 445ª; 467ª;,PERUS,389
7520,VILA SOUZA,"AVENIDA DEPUTADO CANTIDIO SAMPAIO, 6803, São Paulo",-23.438582,EE GENERAL HUMBERTO DE SOUZA MELO,-46.708927,Da 1ª à 21ª.,PERUS,389
4615,VILA SOUZA,"AVENIDA DEPUTADO CANTIDIO SAMPAIO, 6813, São Paulo",-23.44014,EMEF. GENERAL VICENTE DE PAULA DALE COUTINHO,-46.708458,Da 22ª à 31ª; 337ª; 359ª; 372ª;,PERUS,389
4360,PARQUE TAIPAS,"AVENIDA ELIAS ANTONIO LOPES, 165, São Paulo",-23.434246,EMEF. RAUL POMPEIA,-46.714611,Da 90ª à 94ª; 254ª; 270ª; 281ª; 291ª; 299ª; 315ª; 325ª;,PERUS,389
9163,SÍTIO MORRO GRANDE,"AVENIDA ELISIO TEIXEIRA LEITE, 6700 A, São Paulo",-23.444799,EE. ELISIO TEIXEIRA LEITE III,-46.717049,Da 108ª à 119ª.,PERUS,389
9163,VILA BRASILANDIA,"AVENIDA ELISIO TEIXEIRA LEITE, 6700, São Paulo",-23.444799,EE. JACOB SALVADOR ZVEIBIL,-46.717049,Da 72ª à 86ª; 340ª;,PERUS,389
4644,JARDIM SANTA FÉ (ZONA SUL),"RUA JULIA MAMÉIA, 45, São Paulo",-23.779061,EE. DR. CHRISTIANO ALTENFELDER SILVA,-46.716614,Da 27ª à 39ª; 555ª; 565ª;,PARELHEIROS,381
538,VARGEM GRANDE,"RUA IPÊ ROXO, 120, São Paulo",-23.777176,EE. VARGEM GRANDE II,-46.705627,509ª; 521ª; 524ª; 532ª; 536ª; 544ª; 551ª; 559ª;,PARELHEIROS,381
2937,VILA BRASILANDIA,"AVENIDA MORENINHA LINDA, 65, São Paulo",-23.438576,EE. PROF. SALVADOR LIGABUE,-46.713596,Da 95ª à 101ª; 338ª; 364ª;,PERUS,389
3420,JARDIM TAIPAS,"AVENIDA RAIMUNDO PEREIRA DE MAGALHÃES, 12298, São Paulo",-23.435209,EMEF. PROFª ELIANE BENUTE LESSA AYRES GONÇALVES,-46.720001,383ª; 391ª; 396ª; 409ª; 417ª; 424ª; 429ª; 432ª; 437ª; 442ª; 447ª; 456ª; 465ª; 468ª; 475ª;,PERUS,389
272,JARDIM RINCAO,"R XAVIER DOS PÁSSAROS, 39, São Paulo",-23.438295,EMEF. PADRE LEONEL FRANCA,-46.728229,427ª; 449ª; 469ª;,PERUS,389
1953,VILA FLAMENGO,"RUA ALAGOA NOVA, S/N., São Paulo",-23.40074,EMEF. PROFESSORA PHILÓ GONÇALVES DOS SANTOS,-46.74538,298ª; 321ª; 345ª; 369ª; 392ª; 440ª; 482ª;,PERUS,389
2624,VILA PERUS,"RUA ANTONIO MAIA, 476, São Paulo",-23.4079,EMEI. OLIVEIRA LIMA,-46.753448,201ª; 263ª; 271ª; 277ª; 284ª; 287ª; 292ª; 300ª;,PERUS,389
5708,VILA PERUS,"RUA ANTONIO MAIA, 691, São Paulo",-23.406839,EE. DONA SUZANA DE CAMPOS,-46.755039,Da 153ª à 165ª; 334ª; 361ª; 400ª;,PERUS,389
4569,JARDIM SYDNEY,"RUA CONDE MONTERONE, 101, São Paulo",-23.454908,EMEF. RENATO ANTONIO CHECCHIA,-46.716957,Da 87ª à 89ª; 257ª; 272ª; 289ª; 314ª; 331ª; 353ª; 371ª; 389ª; 414ª; 435ª; 458ª;,PERUS,389
2201,PARQUE ANHANGUERA,"RUA CORONEL JOSÉ GLADIADOR, S/N., São Paulo",-23.442499,EE. JARDIM CANAÃ,-46.796242,Da 222ª à 226ª; 262ª; 293ª;,PERUS,389
4714,JARDIM SANTA FE (ZONA OESTE),"RUA DIONISIO BELLANTE, S/N., São Paulo",-23.430441,EMEF. PROF REMO RINALDI NALDDEO,-46.794941,Da 227ª à 229ª; 264ª; 268ª; 274ª; 276ª; 282ª; 285ª; 295ª; 302ª; 375ª; 430ª; 459ª;,PERUS,389
3387,CONJUNTO RESIDENCIAL ELISIO TEIXEIRA LEITE,"RUA EGIDIO FELINI, 81, São Paulo",-23.445869,EMEI. CONJUNTO RESIDENCIAL ELISIO TEIXEIRA LEITE,-46.71645,Da 123ª à 124ª; 259ª; 269ª; 279ª; 290ª; 304ª; 316ª; 320ª; 330ª;,PERUS,389
779,JARDIM BRITANIA,"RUA ELISA DINA, 293 A, São Paulo",-23.433109,EMEF. EDGARD CARONE,-46.790779,310ª; 348ª; 421ª; 471ª;,PERUS,389
2551,JARDIM BRITANIA,"RUA FELIPPO STURBA, 38, São Paulo",-23.43873,EMEF. JARDIM BRITÂNIA,-46.789211,Da 307ª à 308ª; 324ª; 370ª; 386ª; 397ª; 426ª; 438ª; 457ª; 466ª; 481ª;,PERUS,389
3813,PARQUE ANHANGUERA,"RUA FRANCISCO GIRON, SEM NÚMERO, São Paulo",-23.436159,EE. PROF. SEBASTIÃO DE OLIVEIRA GUSMÃO,-46.790501,Da 241ª à 250ª.,PERUS,389
1036,VILA SULINA,"RUA GIOVANNI PALADINO, 76, São Paulo",-23.44986,EE. PROFESSORA ZORAIDE DE CAMPOS HELU,-46.788681,306ª; 346ª; 406ª; 448ª;,PERUS,389
5023,PERUS,"RUA GUILHERME CORREIA DE MELO, 408, São Paulo",-23.399321,EMEF. CANDIDO PORTINARI,-46.751541,Da 166ª à 176ª; 251ª; 335ª; 360ª; 390ª;,PERUS,389
4409,JARDIM TAIPAS,"RUA JOANA PEDROSO DOS SANTOS, 101, São Paulo",-23.426371,EE. PROF. CARLOS BORBA,-46.726181,Da 61ª à 71ª; 357ª;,PERUS,389
5904,CONJUNTO RESIDENCIAL ELISIO TEIXEIRA LEITE,"RUA JOÃO AMADO COUTINHO, 1010, São Paulo",-23.441311,EE. CONJUNTO HABITACIONAL BRIGADEIRO EDUARDO GOMES,-46.711941,Da 47ª à 60ª; 339ª; 358ª; 382ª;,PERUS,389
5841,VILA PERUS,"RUA JÚLIO CÉSAR LEAL, 15, São Paulo",-23.410999,EE. MANUEL BANDEIRA,-46.756741,Da 230ª à 240ª; 342ª; 354ª; 374ª; 394ª; 441ª;,PERUS,389
4821,VILA FANTON,"RUA JULIO DE OLIVEIRA, 9, São Paulo",-23.402975,EMEF. JULIO DE OLIVEIRA,-46.738793,Da 177ª à 188ª; 253ª; 336ª; 362ª;,PERUS,389
10384,VILA PERUS,"RUA MOGEIRO, 710, São Paulo",-23.40514,EE. BRIGADEIRO GAVIÃO PEIXOTO,-46.75956,Da 125ª à 152ª.,PERUS,389
2733,JARDIM MONTE BELO,"RUA PALMEIRÓPOLIS, S/N., São Paulo",-23.4438,EMEF. JARDIM MONTE BELO,-46.801552,294ª; 313ª; 327ª; 347ª; 379ª; 395ª; 425ª; 436ª; 450ª;,PERUS,389
1218,PARQUE ANHANGUERA,"RUA PASTOR JOÃO GRECCHI, 84, São Paulo",-23.42849,EMEI. MARIA JOSÉ DUPRÉ,-46.7957,311ª; 349ª; 387ª; 422ª;,PERUS,389
4463,JARDIM SANTA FE (ZONA OESTE),"RUA POMPEU BERTINI, 80, São Paulo",-23.429871,EMEF. PAULO PRADO,-46.793098,Da 203ª à 213ª.,PERUS,389
506,VILA CAIUBA,"RUA PRESIDENTE VARGAS,  S/N., São Paulo",-23.40056,ETEC. GILDO MARÇAL BEZERRA BRANDÃO,-46.74992,411ª; 418ª; 443ª; 470ª;,PERUS,389
7748,CONJUNTO HABITACIONAL RECANTO DOS HUMILDES,"RUA RECANTO DOS HUMILDES, S/N., São Paulo",-23.41263,EMEF. PROF. JAIRO DE ALMEIDA,-46.750839,Da 194ª à 200ª; 202ª; Da 255ª à 256ª; 267ª; 439ª;,PERUS,389
7748,CONJUNTO HABITACIONAL RECANTO DOS HUMILDES,"RUA RECANTO DOS HUMILDES, S/N., São Paulo",-23.41263,EMEF. JARDIM DA CONQUISTA,-46.750839,388ª; 393ª; 413ª; 423ª; 428ª; 464ª;,PERUS,389
7748,CONJUNTO HABITACIONAL RECANTO DOS HUMILDES,"RUA RECANTO DOS HUMILDES, S/N., São Paulo",-23.41263,EMEI. RECANTO DOS HUMILDES I,-46.750839,305ª; 317ª; 326ª; 333ª; 363ª; 378ª; 451ª;,PERUS,389
4534,JARDIM DO RUSSO,"RUA SILVEIRÂNIA, S/N., São Paulo",-23.40906,EMEF. FERNANDO GRACIOSO,-46.761219,Da 191ª à 193ª; 252ª; 280ª; 297ª; 312ª; 328ª; 351ª; 368ª; 376ª; 407ª; 446ª;,PERUS,389
1146,JARDIM ADELFIORE,"RUA TARCON, 313, São Paulo",-23.40917,EE. PROFESSORA REGIANE DO CARMO MONTEIRO,-46.740021,385ª; 410ª; 420ª; 434ª; 453ª; 472ª;,PERUS,389
4091,JARDIM ADELFIORE,"RUA TARCON, 479, São Paulo",-23.408985,EE. PROF. MIGUEL OLIVA FEITOSA,-46.740417,Da 189ª à 190ª; 261ª; 266ª; 275ª; 288ª; 303ª; 319ª; 332ª; 350ª; 367ª; 373ª;,PERUS,389
960,PARQUE CÍSPER,"AV. LUIZ IMPARATO, 564, São Paulo",-23.498537,CEU. EMEF. QUINTA DO SOL,-46.496758,282ª; 289ª; 299ª; 314ª; 325ª;,CANGAÍBA,390
935,JARDIM DANFER,"PRAÇA CORONEL EZEQUIEL, 10, São Paulo",-23.50215,EMEI PROFESSORA NEUSA CONCEIÇÃO STINCHI,-46.511181,281ª; 292ª; 298ª;,CANGAÍBA,390
1703,ENGENHEIRO GOULART,"PRAÇA GAJÉ, 365, São Paulo",-23.499001,EMEI ENGENHEIRO GOULART,-46.520031,Da 165ª à 168ª; 276ª;,CANGAÍBA,390
3586,ENGENHEIRO GOULART,"RUA ANTÔNIO ROBERTO DE ALMEIDA, 149, São Paulo",-23.50001,EE. REPÚBLICA DO URUGUAI,-46.520126,Da 155ª à 164ª.,CANGAÍBA,390
6362,JARDIM PENHA,"RUA CÂNDIDO MOTA, 267, São Paulo",-23.504923,EE. DOM MIGUEL DE CERVANTES Y SAAVEDRA,-46.495033,Da 176ª à 193ª.,CANGAÍBA,390
4416,VILA SÍLVIA,"RUA COLÔNIA LEOPOLDINA, 340, São Paulo",-23.490875,EE. PROFESSOR VICTÓRIO NAPOLEÃO OLIANI,-46.501621,Da 126ª à 133ª; 241ª; 259ª; 277ª; 303ª;,CANGAÍBA,390
3096,ENGENHEIRO GOULART,"RUA DOS PROFESSORES, 348, São Paulo",-23.502712,COLÉGIO JOAQUIM MARIA MACHADO DE ASSIS,-46.52132,31ª; 236ª; 243ª; 261ª; 278ª; 290ª; 295ª; 305ª; 313ª; 319ª; 323ª;,CANGAÍBA,390
1357,VILA BUENOS AIRES,"RUA ENTRE RIOS, 160, São Paulo",-23.510771,EMEI MÁRIO GRACIOTTI,-46.517097,Da 207ª à 209ª; 263ª;,CANGAÍBA,390
