aptos_por_local,bairro,endereco,lat,local_de_votacao,long,secoes_eleitorais,zona_eleitoral_nome,zona_eleitoral_nro
1768,VILA CENTENARIO,"AV. ALVINÓPOLIS, 1360, São Paulo",-23.531218,EMEI. NENÉ DO AMANHA,-46.530594,239ª; 246ª; 260ª; 303ª; 327ª;,PENHA DE FRANÇA,252
6768,VILA ESPERANCA,"AV. AMADOR BUENO DA VEIGA, 2932, São Paulo",-23.522585,EE. PROFº GABRIEL ORTIZ,-46.518002,Da 127ª à 138ª; 228ª; 265ª; 267ª; 272ª; 277ª; 281ª;,PENHA DE FRANÇA,252
7283,PENHA DE FRANÇA,"AV. AMADOR BUENO DA VEIGA, 604, São Paulo",-23.52224,EE. BARÃO DE RAMALHO,-46.539097,Da 45ª à 62ª; 309ª;,PENHA DE FRANÇA,252
348,PENHA DE FRANÇA,"AV. CONDESSA ELIZABETH ROBIANO S/N, São Paulo",-23.518829,CEU. TIQUATIRA,-46.555199,321ª; 329ª;,PENHA DE FRANÇA,252
4499,VILA CARLOS DE CAMPOS,"AV. DR. ORÊNCIO VIDIGAL, 212, São Paulo",-23.53101,ETE. PROFº APRÍGIO GONZAGA,-46.538849,Da 1ª à 10ª; 233ª; 296ª;,PENHA DE FRANÇA,252
4407,PENHA DE FRANÇA,"AV. GABRIELA MISTRAL, 520, São Paulo",-23.516621,EE. BARÃO DE SOUZA QUEIROZ,-46.549648,Da 79ª à 89ª; 231ª; 306ª;,PENHA DE FRANÇA,252
4012,VILA ESPERANCA,"AV. PADRES OLIVETANOS, 783, São Paulo",-23.529341,COLÉGIO OLIVETANO,-46.527371,Da 148ª à 153ª; 211ª; 214ª; 223ª; 236ª; 295ª;,PENHA DE FRANÇA,252
5870,PENHA DE FRANÇA,"PRAÇA NOSSA SENHORA DA PENHA, 161, São Paulo",-23.5264,COLÉGIO SÃO VICENTE DE PAULO,-46.54956,Da 22ª à 30ª; Da 208ª à 209ª; 212ª; 218ª; Da 220ª à 221ª; 225ª; 313ª;,PENHA DE FRANÇA,252
4534,VILA RÉ,"RUA  SÃO SERAPIÃO, 396, São Paulo",-23.5277,EE. PROFº JOSÉ BARTOCCI,-46.499119,Da 154ª à 162ª; 235ª; 288ª; 301ª;,PENHA DE FRANÇA,252
4478,VILA GRANADA,"RUA ALICANTE, 483, São Paulo",-23.52388,EE. ALMIRANTE CUSTÓDIO JOSÉ DE MELLO,-46.518108,Da 120ª à 126ª; 238ª; 251ª; 255ª; 291ª; 299ª;,PENHA DE FRANÇA,252
2743,ALTO DE PINHEIROS,"RUA DONA ELISA DE MORAES MENDES, 39, São Paulo",-23.554546,COLÉGIO RAINHA DA PAZ,-46.700134,247ª; 250ª; 260ª; 273ª; 281ª; 287ª; 294ª;,PINHEIROS,251
4231,PENHA DE FRANÇA,"RUA COMENDADOR CANTINHO, 394, São Paulo",-23.52507,FACULDADE DRUMMOND,-46.55059,Da 39ª à 44ª; 229ª; 234ª; 252ª; 279ª; 297ª;,PENHA DE FRANÇA,252
2092,PENHA DE FRANÇA,"RUA FRANCISCO COIMBRA, 403, São Paulo",-23.526251,SENAC PENHA,-46.54052,245ª; 249ª; 258ª; 274ª; 284ª; 302ª;,PENHA DE FRANÇA,252
4344,VILA RÉ,"RUA MARCIANO CAPELLA, 257, São Paulo",-23.531389,EE. PROFª ADALGISA MOREIRA PIRES,-46.492908,Da 163ª à 173ª; 310ª;,PENHA DE FRANÇA,252
5523,VILA ESPERANCA,"RUA MARIA CARLOTA, 400, São Paulo",-23.52475,EE. DOM JOÃO MARIA OGNO OSB.,-46.528622,Da 107ª à 119ª; 290ª; 308ª; 330ª;,PENHA DE FRANÇA,252
1972,VILA SAO GERALDO,"RUA MARIA TEREZA ASSUNÇÃO, 441, São Paulo",-23.516367,COLÉGIO PENHA DE FRANÇA,-46.541863,240ª; 257ª; 271ª; 282ª; 315ª; 324ª;,PENHA DE FRANÇA,252
1197,PENHA DE FRANÇA,"RUA MIRANDINHA, 881, São Paulo",-23.529961,EE. PROFª RITA JÚLIA DE OLIVEIRA,-46.535599,292ª; 294ª; 318ª; 326ª;,PENHA DE FRANÇA,252
3694,VILA RÉ,"RUA NHATUMANI, 568, São Paulo",-23.525419,COLÉGIO DOURADO,-46.500279,244ª; 253ª; 256ª; 263ª; 266ª; 270ª; 276ª; 319ª; 322ª; 325ª; 328ª;,PENHA DE FRANÇA,252
4773,PENHA DE FRANÇA,"RUA PADRE BENEDITO DE CAMARGO, 762, São Paulo",-23.521057,EE. NOSSA SENHORA DA PENHA,-46.547928,Da 73ª à 78ª; 217ª; 227ª; 232ª; 261ª; 275ª; 283ª; 312ª;,PENHA DE FRANÇA,252
6676,VILA RÉ,"RUA PANGAUÁ, 210, São Paulo",-23.52953,EE. PROFª MARIA APARECIDA DE CASTRO MASIERO,-46.49921,Da 193ª à 204ª; 210ª; 213ª; 219ª; 222ª; 285ª; 311ª;,PENHA DE FRANÇA,252
8284,VILA RÉ,"RUA PUQUIXÃ, S/N, São Paulo",-23.524651,EE. PROFª MARIA DE CARVALHO SENNE,-46.509781,Da 174ª à 192ª; 215ª; 293ª; 317ª;,PENHA DE FRANÇA,252
2814,VILA ESPERANCA,"RUA RINCÃO, 40, São Paulo",-23.529093,OFICINA PEDAGÓGICA LESTE 1,-46.521564,Da 100ª à 106ª; 307ª;,PENHA DE FRANÇA,252
3996,PENHA DE FRANÇA,"RUA SANTO AFONSO, 273, São Paulo",-23.679634,EE. PADRE ANTÃO,-46.63649,Da 31ª à 38ª; 241ª; 286ª; 305ª;,PENHA DE FRANÇA,252
1357,VILA RÉ,"RUA SANTO HENRIQUE, 50, São Paulo",-23.530031,CDC. ENTURMANDO VILA RÉ CIRCO ESCOLA,-46.501862,248ª; 250ª; 264ª; 314ª;,PENHA DE FRANÇA,252
4359,VILA SANTANA,"RUA SÃO SEVERIANO, 217, São Paulo",-23.51815,EE. PROFº JOSÉ DE CAMPOS CAMARGO,-46.533585,Da 90ª à 99ª; 230ª; 316ª;,PENHA DE FRANÇA,252
4437,VILA LAIS,"RUA TUJUBA, 1475, São Paulo",-23.515209,EE. ESTHER FRANKEL SAMPAIO,-46.541889,Da 63ª à 72ª; 287ª; 298ª;,PENHA DE FRANÇA,252
5212,VILA MARIETA,"RUA UICÓ, 533, São Paulo",-23.52195,EE. PROFº THEODOMIRO EMERIQUE,-46.52142,Da 139ª à 147ª; 216ª; 237ª; 262ª; 300ª; 323ª;,PENHA DE FRANÇA,252
4891,VILA RICA,"AV. INCONFIDÊNCIA MINEIRA, 576, São Paulo",-23.58061,EE. EDUARDO CARLOS PEREIRA,-46.51815,Da 237ª à 241ª; 440ª; Da 449ª à 450ª; Da 454ª à 456ª; 459ª; 563ª;,TATUAPÉ,253
10666,VILA ANTONIETA,"AV. RIO DAS PEDRAS, 2022, São Paulo",-23.570971,EE. PROF. MOACYR CAMPOS,-46.507008,Da 173ª à 200ª; 414ª;,TATUAPÉ,253
5506,VILA CARRAO,"AVENIDA GUILHERME GIORGI, 430, São Paulo",-23.550381,ESCOLA SANTA MARINA,-46.543289,Da 281ª à 292ª; 551ª; 589ª; 613ª; 627ª; 636ª; 647ª;,TATUAPÉ,253
4390,VILA NOVA YORK,"PRAÇA CÂNDIDO MENDES DE ALMEIDA, 184, São Paulo",-23.58029,EE. PROFª ARACY LEME DA VEIGA RAVACHE,-46.507118,Da 226ª à 236ª; 543ª;,TATUAPÉ,253
3563,VILA NOVA MANCHESTER,"PRAÇA HAROLDO DALTRO, 466, São Paulo",-23.546772,EMEF GUIMARÃES ROSA,-46.531452,Da 323ª à 330ª; 554ª; 580ª; 626ª;,TATUAPÉ,253
1723,VILA NOVA MANCHESTER,"PRAÇA HAROLDO DALTRO, S/N, São Paulo",-23.54623,EMEI PROFª SUZANA EVANGELINA FELIPPE,-46.533291,433ª; 437ª; 484ª; 504ª; 553ª; 608ª;,TATUAPÉ,253
3689,MARANHAO,"RUA ADELINO DE ALMEIDA CASTILHO, 178, São Paulo",-23.533266,EE. CARLOS ESCOBAR,-46.5565,Da 52ª à 60ª; 549ª; 576ª;,TATUAPÉ,253
5453,VILA GOMES CARDIM,"RUA AGUAPEÍ, 831, São Paulo",-23.550899,EE. DR. BENEDITO ESTEVAM DOS SANTOS,-46.554851,Da 132ª à 145ª; 556ª; 577ª;,TATUAPÉ,253
2027,VILA RÉ,"RUA HERMILO ALVES, 1090, São Paulo",-23.522283,COLÉGIO RAMA - UNIDADE 2,-46.532249,Da 205ª à 207ª; 226ª; 243ª; 269ª;,PENHA DE FRANÇA,252
1726,JARDIM CATARINA,"RUA ANTÔNIO FERRACIOLI, 283, São Paulo",-23.58429,EE. MARIA PRESTES MAIA,-46.51384,478ª; 502ª; 526ª; 564ª; 599ª; 606ª; 631ª;,TATUAPÉ,253
3789,VILA GOMES CARDIM,"RUA APUCARANA, 815, São Paulo",-23.545666,ETE. MARTIN LUTHER KING,-46.563766,Da 165ª à 172ª; 509ª; 521ª;,TATUAPÉ,253
5463,VILA CARRAO,"RUA CEL. AMARO SOBRINHO, 303, São Paulo",-23.55554,EE. PROFª IRENE RIBEIRO,-46.522942,Da 338ª à 352ª; 436ª; 593ª;,TATUAPÉ,253
1168,PARQUE BOTURUSSU,"RUA MARCO POLO, 905, São Paulo",-23.49761,C.E.I. DELSON DOMINGUES,-46.487911,717ª; 754ª; 775ª;,ERMELINO MATARAZZO,326
3958,VILA ANTONIETA,"RUA CORONEL JOÃO DE OLIVEIRA MELO, 967, São Paulo",-23.576321,EE. DUQUE DE CAXIAS,-46.51226,Da 254ª à 263ª.,TATUAPÉ,253
789,PARQUE MARIA LUIZA,"RUA DR. MARIANO CURSINO DE MOURA, 395, São Paulo",-23.558208,EMEI OLÂNDYA PERES RIBEIRO,-46.516037,430ª; 438ª; 453ª;,TATUAPÉ,253
4114,PARQUE MARIA LUIZA,"RUA DR. PAULO DE ANDRADE ARANTES, 125, São Paulo",-23.55781,EMEF SÉRGIO MILLIET,-46.51712,Da 368ª à 379ª; 558ª;,TATUAPÉ,253
3138,VILA GOMES CARDIM,"RUA EUCLIDES PACHECO, 478, São Paulo",-23.54863,COLÉGIO SÃO FRANCISCO,-46.570251,514ª; 527ª; 530ª; 537ª; 539ª; 571ª; 581ª; 598ª; 609ª; 618ª; 630ª; 635ª; 644ª;,TATUAPÉ,253
5863,TATUAPE,"RUA FELIPE CAMARÃO, 350, São Paulo",-23.53797,EE. OSWALDO CATALANO,-46.579403,Da 1ª à 9ª; Da 28ª à 31ª; 66ª; 399ª; 405ª; 419ª; 544ª;,TATUAPÉ,253
2186,CHACARA CALIFORNIA,"RUA FRANCISCO MACHADO DE CAMPOS, 294, São Paulo",-23.54105,EE. PROF. ALVINO BITTENCOURT,-46.546551,476ª; 495ª; 517ª; 532ª; 565ª; 588ª; 603ª; 620ª; 642ª;,TATUAPÉ,253
4722,VILA GOMES CARDIM,"RUA FRANCISCO MARENGO, 475, São Paulo",-23.541348,EE. PROF. PAULO NOVAES DE CARVALHO,-46.559154,Da 146ª à 157ª; 597ª;,TATUAPÉ,253
8354,CHACARA CALIFORNIA,"RUA GONÇALO NUNES, 310, 366, São Paulo",-23.544161,COLÉGIO MARY WARD,-46.549351,Da 74ª à 79ª; Da 264ª à 270ª; Da 302ª à 307ª; 400ª; 403ª; 415ª; 566ª;,TATUAPÉ,253
5868,JARDIM ANALIA FRANCO,"RUA INSPETOR MÁRIO TEIXEIRA, 41, São Paulo",-23.55584,EE. PROFª BLANCA ZWICKER SIMÕES,-46.566109,Da 80ª à 87ª; 387ª; 393ª; 412ª; 477ª; 497ª; 522ª; 602ª;,TATUAPÉ,253
6876,VILA GOMES CARDIM,"RUA ITAPURA, 976, São Paulo",-23.547443,EE. PROF. JOÃO BORGES,-46.566009,Da 103ª à 118ª; 482ª;,TATUAPÉ,253
5253,JARDIM QUARTO CENTENARIO,"RUA JOAQUIM FELÍCIO, 170, São Paulo",-23.581598,EE. PROFª MARIA DE LOURDES DO ROSÁRIO NEGREIROS,-46.500584,Da 242ª à 253ª; 545ª; 583ª; 619ª;,TATUAPÉ,253
4488,VILA NOVA MANCHESTER,"RUA LUCINDA GOMES BARRETO, 605, São Paulo",-23.546148,EE. CORONEL PEDRO ARBUES,-46.540733,Da 331ª à 337ª; 402ª; 420ª; 432ª; 435ª; 442ª; 548ª;,TATUAPÉ,253
6126,VILA CARRAO,"RUA LUÍS PINTO, 92, São Paulo",-23.554066,EE. PROFª JÚLIA AMÁLIA DE AZEVEDO ANTUNES,-46.536171,Da 308ª à 322ª; 434ª; 472ª; 594ª;,TATUAPÉ,253
4665,VILA ANTONIETA,"RUA MANUEL LUIS DE VERGUEIRO, 365, São Paulo",-23.501501,EE. DEP. NORBERTO MAYER FILHO,-46.478886,Da 388ª à 391ª; Da 394ª à 397ª; 404ª; 406ª; Da 408ª à 409ª; 542ª;,TATUAPÉ,253
3226,TATUAPE,"RUA MARIA EUGÊNIA, 190, São Paulo",-23.533758,EE. ERASMO BRAGA,-46.574116,Da 14ª à 21ª; 559ª;,TATUAPÉ,253
3463,VILA ANTONIETA,"RUA MONTE CARDOSO, 671, São Paulo",-23.567024,EE. NAGIB IZAR,-46.514442,424ª; 439ª; 451ª; 466ª; 485ª; 510ª; 528ª; 570ª; 590ª; 605ª; 624ª;,TATUAPÉ,253
1655,CHACARA CALIFORNIA,"RUA MONTE SERRAT, 468, São Paulo",-23.541504,EMEI QUINTINO BOCAIÚVA,-46.562019,515ª; 531ª; 550ª; 572ª; 591ª; 621ª; 639ª;,TATUAPÉ,253
9484,JARDIM QUARTO CENTENARIO,"RUA PASTOR AGENOR CALDEIRA DINIZ, 48, São Paulo",-23.584795,EE. DONA PILAR GARCIA VIDAL,-46.498314,Da 201ª à 225ª; 552ª;,TATUAPÉ,253
8925,TATUAPE,"RUA CESÁRIO GALENO, 475, São Paulo",-23.586643,UNICID UNIVERSIDADE CIDADE DE SÃO PAULO,-46.509247,Da 22ª à 27ª; Da 32ª à 37ª; Da 61ª à 65ª; 392ª; 398ª; 407ª; 410ª; 417ª; 541ª; 601ª; 638ª;,TATUAPÉ,253
748,TATUAPE,"RUA PARQUE BUTUÍ, S/N, São Paulo",-23.570281,EMEF ARTHUR AZEVEDO,-46.516457,480ª; 492ª; 505ª;,TATUAPÉ,253
6843,VILA CARRAO,"RUA PEDRO MALAQUIAS, 34, São Paulo",-23.555412,ESCOLA ISLÂMICA BRASILEIRA,-46.525692,Da 271ª à 280ª; Da 380ª à 386ª; 413ª; 421ª;,TATUAPÉ,253
3456,VILA GOMES CARDIM,"RUA PROF. PEDREIRA DE FREITAS, 401, 415, São Paulo",-23.550461,FACULDADE E COLÉGIO CARLOS DRUMMOND DE ANDRADE,-46.55822,474ª; 487ª; 496ª; 507ª; 520ª; 560ª; 575ª; 586ª; 604ª; 614ª; 622ª; 633ª; 643ª;,TATUAPÉ,253
2726,VILA ANTONIETA,"RUA REGO BARROS, 501, São Paulo",-23.564058,EE. CARAMURU,-46.517975,481ª; 499ª; 518ª; 536ª; 561ª; 579ª; 607ª; 616ª; 625ª; 634ª; 645ª;,TATUAPÉ,253
3941,VILA CARRAO,"RUA RENATO RINALDI, 31, São Paulo",-23.548531,EE. PROF. SALVADOR ROCCO,-46.545441,Da 293ª à 301ª; 475ª; 573ª;,TATUAPÉ,253
5870,CHACARA SANTO ANTONIO (ZONA LESTE),"RUA SANTA GERTRUDES, 152, São Paulo",-23.548077,COLÉGIO SANTO ANTÔNIO DE LISBOA,-46.556152,Da 67ª à 73ª; Da 158ª à 164ª; 401ª; 411ª; 446ª;,TATUAPÉ,253
1782,PARQUE SAO JORGE,"RUA SANTO ELIAS, 146, São Paulo",-23.53264,EMEI PRESIDENTE DUTRA,-46.566971,Da 10ª à 13ª; 555ª; 596ª;,TATUAPÉ,253
5079,VILA MARIA,"RUA ITAÚNAS, 748, São Paulo",-23.515743,EE. PROFA. FLORINDA CARDOSO,-46.590671,Da 17ª à 29ª; 317ª; 419ª;,VILA MARIA,254
4153,JARDIM IMPERADOR (ZONA LESTE),"RUA SÃO JOÃO DO PARAÍSO, 57, São Paulo",-23.589409,EMEF DES. ACHILLES DE OLIVEIRA RIBEIRO,-46.498184,Da 422ª à 423ª; 441ª; 447ª; 467ª; 483ª; 493ª; 506ª; 519ª; 529ª; 567ª; 600ª; 640ª;,TATUAPÉ,253
4663,VILA GOMES CARDIM,"RUA SERRA DE BRAGANÇA, 990, São Paulo",-23.544712,CENTRO EDUCACIONAL SESI,-46.566353,425ª; 427ª; 445ª; Da 457ª à 458ª; 462ª; 464ª; Da 468ª à 469ª; 490ª; 494ª; 503ª; 562ª;,TATUAPÉ,253
6861,VILA GOMES CARDIM,"RUA SERRA DE JAPI, 445, São Paulo",-23.542971,COLÉGIO AGOSTINIANO  MENDEL,-46.569538,Da 119ª à 131ª; 426ª; 547ª; 568ª; 584ª; 612ª;,TATUAPÉ,253
3799,TATUAPE,"RUA TUIUTI, 1442, São Paulo",-23.53805,COLÉGIO ESPÍRITO SANTO,-46.57563,513ª; 525ª; 535ª; 538ª; 546ª; 569ª; 578ª; 585ª; 592ª; 610ª; 617ª; 623ª; 632ª;,TATUAPÉ,253
1554,VILA GOMES CARDIM,"RUA TUIUTI, 2151, São Paulo",-23.544506,EE. VISCONDE DE CONGONHAS DO CAMPO,-46.574715,516ª; 534ª; 557ª; 582ª; 615ª; 628ª; 641ª;,TATUAPÉ,253
6603,TATUAPE,"RUA TUIUTI, 2865, São Paulo",-23.550545,EE. PROF. ASCENDINO REIS,-46.573013,Da 88ª à 102ª.,TATUAPÉ,253
3443,TATUAPE,"RUA TUIUTI, 2965, São Paulo",-23.551758,EE. PROF. JOÃO CLÍMACO DA SILVA KRUSE,-46.572739,Da 428ª à 429ª; 444ª; 448ª; 460ª; 465ª; 473ª; 488ª; 500ª; 512ª;,TATUAPÉ,253
6162,VILA CARRAO,"RUA VACANGA, 415, São Paulo",-23.560577,EE. DONA AMÉLIA DE ARAUJO,-46.531227,Da 353ª à 367ª; 431ª; 470ª;,TATUAPÉ,253
5334,CARANDIRU,"AV. CONCEIÇÃO, 1385, São Paulo",-23.495247,EMEF. RUI BARBOSA,-46.585178,Da 176ª à 184ª; 286ª; 320ª; 351ª; 369ª; 382ª; 414ª; 438ª;,VILA MARIA,254
861,SANTANA,"AV. CRUZEIRO DO SUL, 2630, São Paulo",-23.507566,ETEC PARQUE DA JUVENTUDE,-46.625164,418ª; 457ª; 465ª; 472ª;,VILA MARIA,254
89,VILA MARIA,"AV. MORVAN DIAS DE FIGUEIREDO 4210, São Paulo",-23.51877,UNID. DE INTERNAÇÃO - OURO PRETO E JOÃO DO PULO (F.CASA),-46.62405,461ª.,VILA MARIA,254
84,VILA MARIA,"AV. MORVAN DIAS DE FIGUEIREDO, 4222, São Paulo",-23.51836,UNIDADE DE INTERNAÇÃO - PAULISTA E NOVA VIDA (F.CASA),-46.617001,458ª.,VILA MARIA,254
6022,VILA PAIVA,"AVENIDA CONCEIÇÃO, 2288, São Paulo",-23.500132,EE. MARIA MONTESSORI,-46.593143,Da 165ª à 175ª; 274ª; 290ª; 302ª; 306ª; 308ª; 401ª; 413ª;,VILA MARIA,254
3288,CARANDIRU,"AVENIDA CONCEIÇÃO, 806, São Paulo",-23.50046,EE. PROF. NARBAL FONTES,-46.605618,Da 185ª à 191ª; 287ª; 402ª;,VILA MARIA,254
5366,JARDIM JAPAO,"AVENIDA DAS CEREJEIRAS, 2435, São Paulo",-23.501215,EE. FRANCISCO DA COSTA GUEDES,-46.572754,Da 103ª à 117ª; 425ª;,VILA MARIA,254
5982,VILA MARIA,"AVENIDA GUILHERME COTCHING, 1272, São Paulo",-23.518303,EE. JOÃO VIEIRA DE ALMEIDA,-46.589348,Da 1ª à 16ª; 403ª;,VILA MARIA,254
2326,VILA MARIA ALTA,"PRAÇA PRES. JÂNIO DA SILVA QUADROS, 270, São Paulo",-23.500481,CEI. JARDIM JAPÃO,-46.583771,284ª; 300ª; 325ª; 343ª; 358ª; 379ª; 410ª;,VILA MARIA,254
6894,JARDIM JAPAO,"PRAÇA PRES. JÂNIO DA SILVA QUADROS, S/N, São Paulo",-23.49942,EMEF. DOM PEDRO PRIMEIRO,-46.579399,Da 90ª à 102ª; 283ª;,VILA MARIA,254
6894,VILA MARIA ALTA,"PRAÇA PRESIDENTE JÂNIO DA SILVA QUADROS, S/N, São Paulo",-23.49942,EMEI. CARLOS GOMES,-46.579399,Da 118ª à 123ª.,VILA MARIA,254
1548,JARDIM JAPAO,"PRAÇA YEDO, S/N, São Paulo",-23.49976,EMEI. PROF. YUKIO OZAKI,-46.574619,416ª; 441ª; 445ª; 448ª;,VILA MARIA,254
3355,VILA MARIA BAIXA,"RUA ALCÂNTARA, 113, São Paulo",-23.52033,ETESG. HORÁCIO AUGUSTO DA SILVEIRA - INDUSTRIAL,-46.595901,Da 268ª à 273ª; 298ª; 303ª; 326ª; 431ª;,VILA MARIA,254
2499,VILA GUILHERME,"RUA AMAZONAS DA SILVA, 737, São Paulo",-23.512999,UNIP - UNIVERSIDADE PAULISTA (CAMPUS SANTANA),-46.609291,332ª; 337ª; 344ª; 367ª; 377ª; 385ª; 406ª;,VILA MARIA,254
3762,VILA GUILHERME,"RUA AMAZONAS DA SILVA, 892, São Paulo",-23.512125,EMEF. OLIVA IRENE BAYERLEIN SILVA,-46.608498,Da 252ª à 259ª; 293ª; 305ª; 327ª;,VILA MARIA,254
8549,VILA MARIA,"RUA ARARITAGUABA, 1330, São Paulo",-23.51507,EE. SEN. PAULO EGYDIO DE O. CARVALHO,-46.581551,Da 50ª à 66ª; 281ª; 316ª; 340ª; 355ª; 408ª; 421ª; 432ª;,VILA MARIA,254
4881,JARDIM ANDARAI,"RUA BENEDITO ALÉSSIO, 184, São Paulo",-23.52626,EMEF. CEL. ARY GOMES,-46.582272,Da 150ª à 154ª; 285ª; 322ª; 341ª; 346ª; Da 359ª à 360ª; 397ª; 433ª; 436ª;,VILA MARIA,254
6202,VILA PAIVA,"RUA CORONEL JORDÃO, 144, São Paulo",-23.507458,EE. CASEMIRO DE ABREU,-46.601757,Da 236ª à 251ª; 328ª; 412ª; 434ª;,VILA MARIA,254
5613,VILA MARIA,"RUA DIAS DA SILVA, 1464, São Paulo",-23.514111,EE. MINISTRO HORÁCIO LAFER,-46.585098,Da 30ª à 39ª; 275ª; 291ª; 299ª; 304ª; 307ª; 309ª; 437ª;,VILA MARIA,254
1199,VILA LEONOR,"RUA DIRCE, 106, São Paulo",-23.502586,EMEF. PROFA. HELENA LOMBARDI BRAGA,-46.598301,330ª; 384ª; 440ª; 467ª; 473ª;,VILA MARIA,254
5069,VILA MARIA ALTA,"RUA GASTÃO MADEIRA, 386, São Paulo",-23.506796,EMEF. JOÃO DOMINGUES SAMPAIO,-46.582046,Da 67ª à 75ª; 280ª; 315ª; 354ª; 390ª; 400ª;,VILA MARIA,254
1001,VILA MARIA ALTA,"RUA GASTÃO MADEIRA, S/N, São Paulo",-23.50573,EMEF. MARIA YOLANDA DE SOUZA PINTO HAHNE,-46.585251,430ª; 446ª; 456ª;,VILA MARIA,254
1098,VILA MARIA ALTA,"RUA GENERAL MENDES, 46, São Paulo",-23.50185,EMEI. EDUARDO CARLOS PEREIRA,-46.591049,423ª; 442ª; 449ª;,VILA MARIA,254
5543,VILA MARIA ALTA,"RUA GENERAL MENDES, 7, São Paulo",-23.500502,EMEF. ALMIRANTE TAMANDARÉ,-46.592323,Da 155ª à 164ª; Da 278ª à 279ª; 321ª; 350ª; 357ª; 368ª;,VILA MARIA,254
7578,VILA MARIA BAIXA,"RUA GUARANÉSIA, 425, São Paulo",-23.519901,UNINOVE - CENTRO UNIVERSITÁRIO 9 DE JULHO,-46.592522,331ª; 335ª; 338ª; 342ª; 353ª; 362ª; 364ª; 371ª; 373ª; 375ª; 378ª; 383ª; 386ª; 391ª; 394ª; 398ª; 407ª; 429ª; 444ª; Da 451ª à 452ª;,VILA MARIA,254
3394,VILA GUILHERME,"RUA JOSÉ BERNARDO PINTO, 758, São Paulo",-23.515671,EE. PROFA. ANÉSIA SINCORÁ,-46.604698,Da 260ª à 267ª; Da 296ª à 297ª;,VILA MARIA,254
6112,VILA GUILHERME,"RUA MARIA CÂNDIDA, 1813, São Paulo",-23.507853,UNIBAN - UNIVERSIDADE BANDEIRANTE DE SÃO PAULO,-46.597862,Da 333ª à 334ª; 348ª; 356ª; 366ª; 370ª; 374ª; 380ª; 388ª; 396ª; 404ª; 427ª; 435ª; 443ª; 450ª; 462ª;,VILA MARIA,254
5573,VILA GUILHERME,"RUA MARIA CÂNDIDA, 1936, São Paulo",-23.50839,EE. AFRÂNIO PEIXOTO,-46.59687,Da 223ª à 235ª; Da 294ª à 295ª; 318ª;,VILA MARIA,254
4790,VILA GUILHERME,"RUA MARIA CÂNDIDA, 293, São Paulo",-23.502247,EE. TOLEDO BARBOSA,-46.611572,Da 210ª à 222ª; 422ª;,VILA MARIA,254
5615,VILA ISOLINA MAZZEI,"RUA NILO LUIS MAZZEI, S/N, São Paulo",-23.49432,EE. GONÇALVES DIAS,-46.603271,Da 200ª à 209ª; 292ª; 319ª; 365ª; 399ª; 420ª; 463ª;,VILA MARIA,254
1929,PARQUE VILA MARIA,"RUA NOSSA SENHORA APARECIDA, 15, São Paulo",-23.495996,EMEF. GAL. PAULO CARNEIRO THOMAZ ALVES,-46.610184,376ª; 395ª; 426ª; 455ª; 464ª; 466ª; 471ª; 476ª;,VILA MARIA,254
1176,PARQUE NOVO MUNDO,"RUA GIUSEPPE MARINO, S/N, São Paulo",-23.515515,EMEF. PROFª. CELIA REGINA LEKEVICIUS CONSOLIN,-46.598167,392ª; 409ª; 417ª; 468ª;,VILA MARIA,254
3478,VILA MARIA ALTA,"RUA SOBRAL JÚNIOR, 234, São Paulo",-23.506029,EE. JÚLIO MAIA,-46.588059,Da 40ª à 49ª.,VILA MARIA,254
1177,PARQUE NOVO MUNDO,"RUA SOLDADO ALBINO CÉSAR, 25, São Paulo",-23.52187,EMEI. ANA NÉRI,-46.566071,415ª; 447ª; 453ª; 469ª;,VILA MARIA,254
4865,PARQUE NOVO MUNDO,"RUA SOLDADO ANTÓNIO ROMANO DE OLIVEIRA, 174, São Paulo",-23.512171,EE. PROF. MÁXIMO RIBEIRO NUNES,-46.573639,Da 124ª à 127ª; 282ª; 324ª; 339ª; 347ª; 349ª; 361ª; 381ª; 387ª; 393ª; 405ª;,VILA MARIA,254
7364,PARQUE NOVO MUNDO,"RUA SOLDADO BENEDITO ELISEU DOS SANTOS, 1817, São Paulo",-23.510941,EE. HERÓIS DA FEB,-46.569801,Da 128ª à 140ª; 277ª; 301ª; 310ª; 312ª; 323ª; 372ª; 424ª; 428ª; 454ª;,VILA MARIA,254
5920,PARQUE NOVO MUNDO,"RUA SOLDADO JOSÉ VICENTE DE PAULA, S/N, São Paulo",-23.521151,EMEF. CEL. ROMÃO GOMES,-46.566662,Da 141ª à 149ª; Da 288ª à 289ª; 313ª; 336ª; 345ª; 352ª; 363ª;,VILA MARIA,254
6356,JARDIM JAPAO,"RUA TOGO, 571, São Paulo",-23.505581,EE. IMPERATRIZ LEOPOLDINA,-46.5779,Da 76ª à 89ª; 276ª; 314ª; 389ª; 411ª;,VILA MARIA,254
5076,CHÁCARA MORRO ALTO,"AVENIDA DEPUTADO EMÍLIO CARLOS, 1980, São Paulo",-23.489634,EE. PAULO SETUBAL,-46.675285,Da 281ª à 290ª; Da 371ª à 372ª; 501ª;,CASA VERDE,255
3044,BAIRRO DO LIMÃO,"AVENIDA DEPUTADO EMÍLIO CARLOS, 318, São Paulo",-23.50176,COLÉGIO PADRE MOYE,-46.673241,389ª; 391ª; 395ª; 400ª; 415ª; Da 436ª à 437ª; 450ª;,CASA VERDE,255
3418,VILA HEBE,"AVENIDA DEPUTADO EMÍLIO CARLOS, 3641, São Paulo",-23.47617,EMEF. PROF. GILBERTO DUPAS,-46.670239,386ª; 398ª; 408ª; 416ª; 428ª; 434ª; 451ª; 464ª; 471ª; 476ª;,CASA VERDE,255
2051,BAIRRO DO LIMÃO,"AVENIDA DEPUTADO EMÍLIO CARLOS, 620, São Paulo",-23.49954,COLÉGIO SILVIO GONZALEZ - UNIDADE 3,-46.674965,Da 484ª à 485ª; 497ª; 514ª; 518ª; 520ª; 528ª; 530ª;,CASA VERDE,255
5422,VILA CARBONE,"AVENIDA DEPUTADO EMÍLIO CARLOS, 900, São Paulo",-23.4979,EE. PROF. LUIZ GONZAGA RIGHINI,-46.675911,Da 291ª à 305ª.,CASA VERDE,255
5974,CACHOEIRINHA,"AVENIDA GENERAL PENHA BRASIL, 139, São Paulo",-23.46969,EMEF. TENENTE AVIADOR FREDERICO GUSTAVO DOS SANTOS,-46.666691,Da 228ª à 241ª; 498ª; 507ª;,CASA VERDE,255
4061,BAIRRO DO LIMÃO,"AVENIDA PROFESSOR CELESTINO BOURROUL, 304, São Paulo",-23.511259,EE. VISCONDE DE TAUNAY,-46.672901,Da 112ª à 122ª.,CASA VERDE,255
2130,BAIRRO DO LIMÃO,"AVENIDA PROFESSOR CELESTINO BOURROUL, 358, São Paulo",-23.510508,EMEI GUIA LOPES,-46.673092,459ª; 466ª; 470ª; 474ª; 483ª; 512ª; 525ª;,CASA VERDE,255
7630,CASA VERDE BAIXA,"PRAÇA DIRCEU DE LIMA, 617, São Paulo",-23.51088,EE. PROF. BENEDITO TOLOSA,-46.65744,Da 85ª à 102ª; 377ª; 456ª; 492ª;,CASA VERDE,255
2481,VILA NOVA CACHOEIRINHA,"RUA ANTÔNIO DOMINGUES FREITAS, 147, São Paulo",-23.471941,EMEF. PROF. ROBERTO PATRÍCIO,-46.654266,387ª; 401ª; 413ª; 421ª; 443ª; 458ª; 482ª; 527ª;,CASA VERDE,255
5116,VILA CARBONE,"RUA ANTÔNIO RIBEIRO DE MORAIS, 184, São Paulo",-23.491631,EE. ANTOINE DE SAINT EXUPERY,-46.68108,382ª; 396ª; 405ª; 410ª; 420ª; 422ª; 430ª; 442ª; 455ª; 465ª; 469ª; 473ª; 511ª; 526ª;,CASA VERDE,255
5319,JARDIM SÃO MIGUEL,"RUA ARMANDO COELHO DA SILVA, 859, São Paulo",-23.49161,EMEF. COMANDANTE GARCIA D'ÁVILA,-46.65464,Da 59ª à 71ª; 490ª;,CASA VERDE,255
2402,CASA VERDE BAIXA,"RUA BRAZELIZA ALVES CARVALHO, 356, São Paulo",-23.512814,EMEF. PAULO NOGUEIRA FILHO,-46.650471,Da 107ª à 111ª; 376ª; 452ª; 481ª;,CASA VERDE,255
5733,VILA DIONÍSIA,"RUA CAMILO PEÇANHA, 10, São Paulo",-23.465691,EMEF. PROF. OSWALDO QUIRINO SIMÕES,-46.662151,Da 242ª à 251ª; Da 349ª à 352ª; 385ª; 499ª; 505ª;,CASA VERDE,255
6658,VILA NOVA CACHOEIRINHA,"RUA DEZ DE MAIO, 271, São Paulo",-23.470465,EE. PROF. ANTÔNIO JOSÉ LEITE,-46.655369,Da 252ª à 266ª; 339ª; 500ª; 510ª;,CASA VERDE,255
9957,VILA SIQUEIRA,"RUA DONA ESTELA BORGES MORATO, 500, São Paulo",-23.50223,EE. TARCÍSIO ALVARES LOBO,-46.681217,Da 123ª à 142ª; 325ª; Da 345ª à 348ª; 355ª;,CASA VERDE,255
4128,CASA VERDE ALTA,"RUA DOUTOR FLEURY SILVEIRA, 295, São Paulo",-23.489719,EMEI VICENTE PAULO DA SILVA,-46.670212,Da 306ª à 314ª; 384ª; 453ª;,CASA VERDE,255
3450,TUCURUVI,"AV. NOVA CANTAREIRA, 2724, São Paulo",-23.47455,INSTITUTO EDUCACIONAL SANTA JOANA D'ARC,-46.613129,Da 1ª à 9ª.,TUCURUVI,256
5867,SÍTIO DO MANDAQUI,"RUA EPAMINONDAS MELO DO AMARAL, 156, São Paulo",-23.484011,COLÉGIO PIAGET,-46.655151,399ª; 406ª; 412ª; 417ª; 423ª; 432ª; 448ª; 463ª; 468ª; 472ª; 475ª; 478ª; 480ª; 513ª; 516ª; 524ª; 529ª; 531ª;,CASA VERDE,255
4303,VILA BARBOSA,"RUA FRANCISCO AUGUSTO LOPES, 223, São Paulo",-23.49699,EMEF. PROF. AROLDO DE AZEVEDO,-46.672199,Da 360ª à 364ª; 390ª; 424ª; 431ª; 449ª; 467ª; 506ª;,CASA VERDE,255
6042,JARDIM IBÉRIA,"RUA GRACIANO ALTIERI, 114, São Paulo",-23.493576,EE. PROF. COLOMBO DE ALMEIDA,-46.660755,Da 170ª à 184ª; 495ª;,CASA VERDE,255
4206,CASA VERDE MÉDIA,"RUA GUARIZINHO, 587, São Paulo",-23.49856,LICEU CARVALHO PINTO,-46.661129,380ª; 392ª; 394ª; 404ª; 419ª; 427ª; 435ª; 446ª; 457ª; 494ª; 509ª; 519ª;,CASA VERDE,255
4205,JARDIM DAS LARANJEIRAS,"RUA IATAI, 7, São Paulo",-23.506273,COLÉGIO NOSSA SENHORA DAS DORES,-46.661728,Da 1ª à 8ª; 433ª; 447ª; 486ª; 503ª;,CASA VERDE,255
2165,VILA BARUEL,"RUA JOÃO RUDGE, 577, São Paulo",-23.511515,COLÉGIO CENTENÁRIO,-46.657311,388ª; 402ª; 407ª; 429ª; 441ª; 461ª;,CASA VERDE,255
4713,VILA SANTISTA,"RUA JOSÉ SORIANO DE SOUSA, 30, São Paulo",-23.49523,EE. MATILDE MACEDO SOARES,-46.667862,Da 340ª à 344ª; 359ª; Da 366ª à 368ª; 381ª; 425ª; 508ª;,CASA VERDE,255
4738,CASA VERDE ALTA,"RUA MANOEL DIAS DO CAMPO, 464, São Paulo",-23.485781,EMEF. HUMBERTO DANTAS,-46.670792,Da 315ª à 324ª; 383ª; 504ª; 523ª;,CASA VERDE,255
4430,SÍTIO CASA VERDE,"RUA MARACAIA, 204, São Paulo",-23.469919,EE. REPÚBLICA DO CHILE,-46.66367,Da 218ª à 227ª; Da 373ª à 374ª;,CASA VERDE,255
4709,VILA BELA VISTA (ZONA NORTE),"RUA MARIA DE SÃO JOSÉ CUNHA, 108, São Paulo",-23.467787,EE. PROF. ALFREDO GOMES,-46.657463,Da 267ª à 280ª.,CASA VERDE,255
7749,VILA DOS ANDRADES,"RUA MENDONÇA JÚNIOR, 611, São Paulo",-23.476732,EE. TITO PRATES DA FONSECA,-46.664001,Da 203ª à 217ª; Da 326ª à 328ª; 502ª; 515ª;,CASA VERDE,255
5270,VILA BARUEL,"RUA NOVA GRANADA, 35, São Paulo",-23.505104,ETEC ALBERT EINSTEIN,-46.659672,Da 103ª à 106ª; Da 329ª à 338ª; 522ª;,CASA VERDE,255
7098,JARDIM SÃO BENTO,"RUA NÚRSIA, 412, São Paulo",-23.502727,EE. CAPITÃO PEDRO MONTEIRO DO AMARAL,-46.650635,Da 33ª à 47ª; 375ª; 454ª; 488ª;,CASA VERDE,255
2660,PARQUE PERUCHE,"RUA OURO GROSSO, 933, São Paulo",-23.5007,COLÉGIO OURO GROSSO,-46.656609,403ª; 409ª; 414ª; 426ª; 444ª; 460ª; 477ª; 479ª;,CASA VERDE,255
6582,IMIRIM,"RUA PADRE JOÃO GUALBERTO, 311, São Paulo",-23.491421,EE. PROF. AUGUSTO MEIRELLES REIS FILHO,-46.651588,Da 72ª à 84ª; Da 353ª à 354ª; 378ª; 445ª; 491ª;,CASA VERDE,255
6596,CASA VERDE,"RUA SANTA EUDÓXIA, 630, São Paulo",-23.49786,EE. ARY BARROSO,-46.655541,Da 48ª à 58ª; 365ª; Da 369ª à 370ª; 379ª; 462ª; 489ª;,CASA VERDE,255
